title;upvotes;author;comments;upvote_ratio;created
An r/ApexOutlands horny meme gives you a choice, which way, Gamer Man: Transphobia or Trans Fetishization?;379;Uncommonwealth57;122;0.93;1667378051.0
A lone Joe Rogan defender takes a stand against drag shows and fentanyl in the subreddit for left-wing radio show and podcast, r/TheMajorityReport.;1018;BillFireCrotchWalton;263;0.96;1667372575.0
Is vandalism really justified in promoting walkable cities? r/fuckcars is divided over several activists damaging displayed sports cars.;402;P78903;411;0.93;1667353825.0
Some fun-sized drama when a parent proudly posts a pic of sorted halloween candy on r/oddlysatisfying. Many find it odd but not satisfying. Others suspect outright fraud: YOU SIT ON A THRONE OF LIES;196;Feralpudel;73;0.97;1667341651.0
So apparently some Fox execs would call Glee “the f*g show” behind closed doors, but it’s ok to call it that because some cast and crew (probably) called it that too, but OP isn’t ok with that, and that’s what you missed on Glee;2912;ahomelessjedi;351;0.97;1667337153.0
Idiot in Car is unaware he is is the idiot in a car;315;HGpennypacker;79;0.96;1667316556.0
R/popheadscirclejerk circles and jerks around anti-Taylor Swift messiah;170;carrie-satan;79;0.91;1667300921.0
OP posts a video in r/iamatotalpieceofshit calling people laughing at cars going over a big pothole a POS, not one user in the thread agrees with OP;663;Nitrozah;201;0.97;1667300242.0
"Local law enforcement holds press conference to announce an arrest in the 2017 ""Delphi Murders"" case. Some members of /r/delphimurders aren't happy.";781;CrustyCatheter;284;0.97;1667274073.0
Everyone took the full bowl of candy as a kid? One user claims so then gets ripped apart;186;snypesalot;86;0.95;1667269697.0
Two users argue with each other for almost a MONTH about vocabulary, who wants to have the last word and whether one user abused the Reddit suicide prevention bot;2090;Reesewithoutaspoon2;269;0.99;1667255651.0
Saudia Arabia celibrates Halloween , r/saudiaarabia is not happy, calls it a satanic ritual.;1301;Creepy_Toe2680;409;0.96;1667236214.0
"""Even [Trumpettes saying Trump is a Godsend] would never say “God bows down to Trump.” A little critical thinking is in order."" -r/atetheonion clashes over Satire Detection";620;DonaldDuckJTrumo;71;0.94;1667220613.0
A Ukrainian soldier records himself in a Mandalorian mask Seig Heil-ing in front of a missile launch. Some users in /r/CombatFootage do nazi how this is possible.;1413;ThumYorky;690;0.89;1667181810.0
Pajamas in public draws a mixed response in r/Ohio;951;UnitedPatriot65;346;0.96;1667168889.0
Over the past week r/starterpacks has cannibalized itself into a war of cats vs dogs.;355;SethlordX7;71;0.95;1667154905.0
It's time for a showdown at high noon at the r/ffxiv corral over questionable advertising;91;ForteEXE;37;0.91;1667160644.0
"""Empathy is weakness, you come from a weak culture"": r/childfree user has a hot take on not feeding poor kids";1858;riverstyxoath;465;0.97;1667065414.0
r/wholesomememes gets a little unwholesome to talk about laws against feeding the homeless;385;Georgia_Ball;90;0.98;1667056264.0
Two Redditors disagree about UFOs, discussion goes on for 2 hours and 46 responses;269;ReneDeGames;78;0.96;1667047123.0
r/iran starts banning anyone in support of the protests. They make a new subreddit called r/NewIran and then r/iran gets more pissed and starts calling them infidels;3807;Creepy_Toe2680;351;0.98;1667038572.0
Are helmets necessary for skateboarding? Or is Reddit just tubby? An Intelligent and Athletic Redditor on /r/whatcouldgowrong has some opinions on the matter;154;I_Miss_Lenny;119;0.96;1667014685.0
Bayonetta voice actor drama reaches an all time high when it is revealed that the original voice actor lied about her initial offer, and tells fans to boycott the game and donate to an anti-abortion charity instead. /r/gamingcirclejerk discusses;3773;Commander_Keller;642;0.98;1666981348.0
Is killing a mosquito worthy of r/mademesmile? What’s the text book definition of murder? Can someone be unnecessarily edgy in the comments? Let’s find out!;433;TheGlassHammer;183;0.95;1666967627.0
New Terms of service update suggests data caps are coming to Starlink service. Users in the starlink subreddit have a civil discussion about the impacts data caps will have on the user experience;340;General-Programmer-5;77;0.97;1666895137.0
Less than two months after the release of F1 Manager 2022, Frontier announces they will stop fixing game-breaking bugs in the game to work on F1 Manager 2023 instead. The community is somewhat unimpressed.;505;lu8273;64;0.98;1666892137.0
A few months ago, in a subreddit far far away, Redditors talk about canonical racism in Star Wars;429;ahomelessjedi;140;0.96;1666876939.0
r/Overwatch_Memes react to developers eating breakfast;1188;SS_Downboat;455;0.96;1666875355.0
Users are not Cartographically Titillated in r/mapporn;885;Deviancy_Is_Art;265;0.98;1666838723.0
"Users on /r/Overwatch accuse mods of wanton deletion of posts to do ""damage control"" for Blizzard. The main accusation thread hit /r/all and the community is split";1278;Roflkopt3r;463;0.97;1666813492.0
Kids getting poisoned candy for Halloween? Myth. Kids getting 3D printed Oreos for Halloween? Apparently one r/crafts poster is trying to make that happen, reactions are mixed.;1184;half_ginger_price;240;0.98;1666796380.0
r/ModeratePolitics deletes a 'State of the Subreddit' thread when mod favoritism is alleged, creates a new thread only to be criticized further;1203;Sudden-Ad-7113;283;0.96;1666794738.0
r/Fantheories discusses the MCU…and Nazi genetic ideology?;101;gallerton18;38;0.93;1666794129.0
OP outs himself as a Juror in the current Darrell Brooks Trial. The judge addresses this subreddit post and comments live and the post is now flooded with hundreds of comments.;3912;Ashamed-Grape7792;1189;0.98;1666743607.0
r/DC_Cinematic has a Crisis when James Gunn is announced as a head of DC Studios;155;Mr_briskets;133;0.93;1666742539.0
r/Christianity debates Christian Nationalism. Again.;285;IsNotPolitburo;139;0.94;1666734571.0
r/idiotsincars debate whether a Mazda CX-5 is a hatchback or SUV;101;agoodnametohave;55;0.95;1666725477.0
Drama happening in a BPT thread about Adidas ending contract with Kanye. Is Adidas racist for not leaving Kanye earlier?;423;repubsdontlikeme;433;0.95;1666724251.0
Philosophers and ethicists emerge in dndmemes to engage in civil discourse: Is it fair to categorically assign a race an evil alignment?;203;OnsetOfMSet;227;0.95;1666708573.0
"OP in r/selfimprovement tells people that ""porn is poison"" 99% of users make fun of OP";1770;Nitrozah;636;0.96;1666701175.0
r/memes has huge arguement over meme about guns in America vs European alternative;123;McDonaldsnapkin;109;0.95;1666693808.0
"Star Citizens calmly discuss the developers' official ""zero tolerance for homophobia, transphobia, racism, and bigotry"" announcement and moderating";645;QuaversAndWotsits;211;0.96;1666651626.0
Abortion related slapfight starts in /r/Nothowgirlswork when one user points out “the irony of this comment”;80;krully37;24;0.92;1666647504.0
"""I wouldn't do shit to you because you'd probably masturbate to said shit"" a Redditor requests control of r/AskRedditAfterDark after being banned, commentors discover he was spamming the sub with scat questions.";169;IAbstainFromSociety;12;0.95;1666640134.0
Rishi Sunak, a British conservative MP of Indian heritage is elected Prime Minister. The Conservative Sub reacts accordingly.;2588;Kenyalite;607;0.97;1666633363.0
"""I make up science to support my political views, so obviously everyone else does too."" r/politicalcompassmemes takes it upon themselves to deconstruct the scientific method.";829;Cursory_Analysis;171;0.96;1666631973.0
Is OP a sadistic anti fun player? One OW fan loses his cool over this icey play;166;snypesalot;89;0.94;1666618975.0
Redditor on RadicalChristianity finds out that Stalin isn’t very popular there.;932;TOAOFriedPickleBoy;303;0.94;1666615184.0
Twitch streamer xQc's battle from fighting Covid and a double ear infection has intensified. /r/xqcow reacts.;1651;surgingchaos;527;0.95;1666563856.0
User in /r/LawyerTalk supports Darrell Brooks's defense, drama throughout multiple threads and throughout another subreddit ensues;542;justcool393;176;0.97;1666477406.0
It's a Debate, not an Argument, about whether Kanye West is a Celebrity or simply Popular, in this BPT bite.;916;DeathandHemingway;99;0.95;1666454680.0
Anime_IRL debates the age old question - Are Lolicons Pedophiles?;813;KikiFlowers;615;0.93;1666417309.0
Are Jews halting diversity? Is the theory that Jews own the world really anti semitic? r/Justunsubbed gets into a debate over a post involving Jews;380;Proof_Individual6993;92;0.96;1666409334.0
/r/RantGrumps is making some Friday late night popcorn over the defense for JonTron. It doesn’t work obviously.;159;Deep_Scope;114;0.94;1666409257.0
r/conservative debates free-speech and cancel culture, after Newsmax network cuts ties with journalist Lara Logan for accusing world leaders of 'dining on blood of children' and calling immigration 'Satans way of taking control of the world.';2547;IsNotPolitburo;419;0.97;1666393079.0
Corn pops in r/Iowa over the difference between farmer vs student loan forgiveness.;781;jamsterDAMN;477;0.97;1666388832.0
OP in r/conspiracy believes flat earth theory is a 'psyop' designed to make conspiracy theorists look stupid. Flat earthers resent this theory.;3323;IsNotPolitburo;576;0.99;1666316970.0
Strong men create good times and good times create vegan slapfights.;746;riverstyxoath;260;0.93;1666292423.0
“When you see a rattlesnake, you should leave it alone” - Army veteran with PTSD sits in the front row of a comedy show, triggers big time, then comes to the subreddit to defend himself;2122;h0m3r;570;0.97;1666251286.0
Is it morally right to promote discriminatory government policy? /r/Christianity argues;983;dolphins3;328;0.96;1666234331.0
"Bite size drama in r/raimimemes because of a simple question: ""Who's Tucker?""";328;Iamnotgoodwithnames6;67;0.95;1666217217.0
OP asks OnlyFans content creators how he can have sex with them, then proceeds to question whether sex work is real work.;1837;BillFireCrotchWalton;505;0.97;1666158609.0
Op posts a dirty, old, but still working kettle in r/Anticonsumption. Proceeds to argue with commenters about their dirt.;1177;bumpyitalian;253;0.98;1666142944.0
It's time for a rousing match of Drama of the Ancients 2 as r/dota2 discusses using in-game item renaming for questionable reasons...again...;174;ForteEXE;42;0.96;1666132990.0
Recurring JRE guest Sam Harris wades into the Ye drama. r/JoeRogan discusses Nick Cannon, Islam, and Hunter Biden.;437;crustyrusty91;351;0.93;1666111781.0
Roosterteeth drama continues;1606;Couch_Licker;726;0.96;1666097813.0
"OP asks r/Australia ""Why is being an organ donor opt in?"" Proceeds to argue with many people in the comments.";243;And_be_one_traveler;113;0.95;1666088038.0
Voice actor Hellena Taylor makes a series of exposed videos on a ridiculous offer they made her to reprise her role in Bayonetta 3, asked fans to boycott the game, she goes viral and gamers across reddit debacles.;1504;deleted;561;0.95;1666056611.0
A woman's boyfriend gets a very peculiar invitation to a gala and r/Austin discusses.;543;coreythebuckeye;119;0.96;1666052730.0
r/Kanye continues to mald as Kanye continues his spiral.;1848;BigCIitPhobia_;496;0.95;1666027130.0
Ex-porn star gets announced in Cyberpunk expansion role, r/pcgaming reacts;1265;ForteEXE;519;0.96;1665901969.0
Does the rooster need a root canal? Drama going down at r/RoosterTeeth in their latest scandal involving dissolving (aka firing) of beloved employees and the revelations of current loved hosts using homophobic nicknames.;851;deleted;272;0.97;1665901484.0
Did Jesus REALLY mean it when he criticized the wealthy? Should Christians be as critical of billionaires as they are of gay people? /r/Christianity has their daily LGBT inquisition.;2332;dolphins3;483;0.97;1665876040.0
Self proclaimed very strong nationalist and fascist goes to r/Christianity to debate 'liberal panic' over rising Christian nationalism, and whether not Christianity is compatible with nationalism.;461;IsNotPolitburo;142;0.96;1665873582.0
Metaslapfight on /r/quityourbullshit regarding ostensibly antivax bullshit being called out—or was the original clearly satire? The stakes are high;39;Mordisquitos;7;0.88;1665872371.0
Is making fun of female rappers silly fun? Or is it rascist misogyny? Can OP be an incel if she's a woman? Tune into r/starterpacks for a nuanced discussion.;1489;invesigator_gator;308;0.96;1665865160.0
Someone got a note on their car. Now it's a debate whether they hit the car or not;435;Mackheath1;77;0.97;1665844263.0
AOC's town hall is disrupted by r/WayOfTheBern redditors upset by her support for Ukraine;1925;sansampersamp;753;0.94;1665808798.0
Nothing is stronger than family, right? A video posted to r/aww of a baby being given to Dwayne Johnson goes down a Rocky road when the entire comments section responds Fast and Furiously with criticism against the parents and calls to take the child to CPS.;202;deleted;54;0.95;1665801204.0
It's r/nottheonion but drama when a video of Jordan Peterson crying gets posted and lobsters respond;1080;ForteEXE;302;0.95;1665788022.0
Accusations of sexualization of children lead to a comment brawl in /r/FFXIV over fan drawings of 14 year old girl. Can't you point out sexualization of children without sexualizing them yourself? Debate breaks out.;429;Tomotronics;246;0.94;1665774760.0
More Deca, More Drama! Things get juicy in /r/MorePlatesMoreDates when a teenager posts his unnatural progress.;189;Cupinacup;122;0.95;1665765122.0
When r/poetry sees a Klansman, they should (a) punch him (b) become vegans, you hypocrites! (c) stop making this political because the KKK was never political (d) FASCISM WASN'T EVEN A WORD WHEN THIS POEM WAS WRITTEN!!!;1918;NandiniS;462;0.96;1665751935.0
Is work getting done outside of OPs room at 7am too early? Users from /r/wellthatsucks don't all seem to think so;943;5hnq;152;0.96;1665710764.0
“I’m a man meant to kill and exterminate my enemies”. A 23 year old /r/INTJ user proudly boasts his life plan to the horrors of others.;2370;ThumYorky;816;0.99;1665636504.0
OP asks for an opener for a woman with kids. r/Tinder drags them for... many reasons.;531;xxaerith;166;0.96;1665632990.0
Can LSD make you straight? Will Commies defeat the Sweet Baby Gang? Is gender a religious ideology? r/DeclineIntoCensorship discusses the ban of r/MattWalsh;319;Billcat123;100;0.96;1665627854.0
/r/PoliticalCompassMemes reacts to the near billion dollar civil suit against Alex Jones.;1824;WhnWlltnd;615;0.97;1665624355.0
Is Columbus the real MVP and Erikson should just be the footnote? R/ historymemes discusses;117;neverjumpthegate;82;0.94;1665621163.0
Is a cartoon lion gay? Am I gay?;838;Nopeyesok;389;0.93;1665606407.0
/r/StableDiffusion faces a mass exodus after staff at Stability take ownership of the subreddit and kick out the old mods;338;Kitria;65;0.96;1665520834.0
r/conspiracy argues if fact-checking is a malevolent Democrat scam;2012;better_logic;297;0.96;1665520419.0
r/Superman gets super-dramatic over the sales of bisexual Superman;305;Mr_briskets;132;0.93;1665517956.0
Two different users post same screenshot in r/conspiracy and r/facepalm about Netflix social engineering and cannot provide a single example. Enjoy this two pack drama in pack of one;1422;Biryani-Man69;247;0.97;1665503615.0
"Moderator of an unnamed ""anti-racist subreddit"" takes to /r/ModSupport to demand the admins explain their ""draconian"" and ""unjustifiable"" removal of a mod for violating a week-old rule. Shockingly, the story falls apart with the bombshell revelation of (checks notes) the subreddit's name.";2033;yukichigai;385;0.97;1665434895.0
NHL Player Ian Cole gets accused of raping an underage girl on twitter, compelling r/hockey, r/NHL, r/penguins, r/stlouisblues, r/canes, r/ColoradoAvalanche, and r/TampaBayLightning to have several rational discussions regarding the accusations;1824;Professional_Ship107;300;0.97;1665401989.0
/r/toiletpaperusa has another a tankie takeover, goes temporarily private, and then gets back in the hands of the old team;1471;GreenHairedSnorlax;429;0.93;1665345857.0
Bipolar continues to be a hell of a drug as r/kanye reacts to antisemitism;2556;AbruptAbe;629;0.97;1665313758.0
StableDiffusion bans prominent open-source programmer AUTOMATIC for alleged copyright infringement of a completely different company. He pulls an uno-reverse claiming they stole his code. This coincides with an AMA occurring tomorrow.;911;Chakota;197;0.96;1665293543.0
Mod from r/Onlyfans101 confirms to have connections with admins;3065;wolf55HGFfa;401;0.97;1665217128.0
Egypt wants the Rosetta Stone back from the British Museum, r/anime_titties discusses.;2014;akaispirit;684;0.97;1665169633.0
Pledge of Allegiance is posted on /r/propagandaposters. Which upsets a redditor who takes his gripe to /r/justunsubbed;2300;I-WANT2SEE-CUTE-TITS;351;0.97;1665135556.0
The brigades are out in full force as Matt Walsh advocates impregnating and marrying 16 year old girls. r/facepalm, r/OutOfTheLoop, and r/ToiletPaperUSA clash with the likes of r/conservative, r/BenShapiro, r/MensRights, and r/KotakuInAction;2166;SS_Downboat;417;0.97;1665078158.0
Redditor writes a book, posts about it, and gets an extremely negative response.;1151;Bradley271;517;0.99;1665077100.0
"""Another emasculated man. Rip"" Some people in /r/funny get testy after OP's wife makes him a cake shaped like balls to celebrate his vasectomy.";1794;18CupsOfMusic;652;0.96;1665073030.0
r/sticknpokes gets prickly when an edgy teen posts their homemade hand tattoos;189;academictoss;61;0.97;1665067215.0
Should have locked up the Dungeons in /r/dndmemes as discussions about sexual assault in a campaign specific meme reaches eldritch-level abomination;252;whoaholdonwaitwhat;133;0.95;1665044274.0
An angry OP /r/Aroids to vent their frustration about their loss in profits of rare plants due to increased popularity of the trade. OP is politely eviscerated.;155;ThumYorky;24;0.97;1665030393.0
Users square up on DankChristianMemes over OP rationalizing biblical slavery.;175;Road_Whorrior;51;0.95;1665009901.0
r/Onlyfans101 mods are currently manipulating tons NSFW subreddits.;6142;wolf55HGFfa;687;0.98;1664999729.0
R/CozyPlaces isn't so Cozy when OP posts their backyard;654;Enticing_Venom;258;0.97;1664996780.0
OP posted a video of her sister's dog, some Redditors on r/germanshepherds didn't react pawsomely.;194;Educational-Salt-979;130;0.96;1664990393.0
A small hiccup occurs in r/AssholeDesign. Or should that be hiccough?;123;allenthalben2;32;0.96;1664983887.0
r/KotakuInAction argues over sex dolls that look like children;1212;better_logic;570;0.94;1664979870.0
Is Jeffrey Dahmer in heaven? r/trueChristian debates;1891;calithetroll;807;0.96;1664918149.0
r/marvelstudios debates vaccines and sexism on a cosplay post;281;gallerton18;164;0.95;1664908650.0
r/hockey devolves into accusations of racism, discussions of what countries have committed the worst crimes, and questions of if Canadians are morons over the Czech government’s attempts to ban Russian hockey players from the upcoming NHL exhibition game in Prague;129;Professional_Ship107;48;0.95;1664901977.0
popcorn flies in /r/europe when Poland asks for WW2 reparations from Germany. Is there an expiration date on genocide?;1079;Butterscotch766;373;0.95;1664890551.0
"Kanye West wore ""White Lives Matter"" r/kanye reacts to it.";2414;Educational-Salt-979;620;0.97;1664823976.0
Fun little argument about self-defense in r/knives;68;TheLadyEve;164;0.84;1664810939.0
"""You know that can get your child taken from you in America. Not even remotely funny."" /r/funny is split over whether or not giving a baby wasabi is child abuse.";520;18CupsOfMusic;246;0.96;1664797089.0
Is a wife pegging her husband a sin? r/trueChristian discusses;2331;WhatsMyUsername13;617;0.96;1664765540.0
One Piece fan in r/MemePiece really hates one particular character. Essay-length comments are written. Thread is locked.;189;insertusernamehere51;86;0.93;1664760489.0
(hugely mediocre drama) mods in r/crochet remove a post showing a cat. Other posters demand to see the cat or they will riot.;452;RainingBlood398;48;0.95;1664750830.0
Things get heated in r/houston over whether dogs should be allowed in coffee shops;307;masterbirder;246;0.97;1664727615.0
User goes to r/catholicism to complain about 'modernists' infiltrating his church. Drama ensues when another user declares that he is ALSO a modernist heretic for thinking women should be allowed to work outside the home.;2208;IsNotPolitburo;631;0.98;1664724809.0
Golfer in *ahem* r/Golf plays on a course where the holes have been put in very difficult spots. Things get chippy when trying to decide if OP is right to be so upset.;743;Large_Talons_;108;0.96;1664721366.0
"OP says that /r/writing ""isn't really about writing"" and compares it to a support group. Redditors then demonstrate just how supportive the community is in the comments";670;Raptor--Red;136;0.97;1664668689.0
"Mod in r/publicfreakout gives us the best freakout of all: ""i'll tell you waht. i'm going make sure i approve an extra helping of irrelevant shitposts just for you for being such a dumb cunt.""";209;RondoJr;50;0.95;1664661666.0
The fear of a future robot police state sends waves of panic through an r/interestingasfuck comment section.;485;Tweedleayne;195;0.96;1664650605.0
r/Dota2 arguing over Valve hiring multiple vocal Pro-Russian war announcers/shoutcasters for their upcoming tournament.;943;bikwho;140;0.97;1664648652.0
Schism over fridge discourse on r/Starbucks: To Doodle or not Doodle;209;Worried-Translator99;82;0.97;1664633983.0
"""This is why you got hit and now I am happy you did"". Some /r/idiotsincars users have very strong opinions when OP gets hit in a construction zone by a speeding car.";873;Hammer5320;224;0.96;1664625679.0
A mini slapfight between 2 users in r/AbsoluteUnits that started with giant bunny and ended with pedo and racism;170;raffenstein;15;0.97;1664624645.0
r/dankmemes followers argue for or against incest;194;NobodyXNo;63;0.96;1664588977.0
r/denverbroncos mod tweets from denver_broncos twitter account regarding head injuries/CTE in NFL specifically Tua Tagovailoa;95;PositivePicks;35;0.92;1664581681.0
Is twerking vulgar?;0;TAKEitTOrCIRCLEJERK;58;0.43;1664576045.0
r/poker goes all in after a female poker player wins a $270K pot against the GOAT on a high-stakes poker livestream.;1528;_roec_;886;0.94;1664572937.0
This argument gets risky as two redditors battle over Hasbro's classic game of world domination and re-ignite an old war.;195;jrrfolkien;60;0.96;1664550088.0
r/Catholicism debates whether or not it's acceptable for a priest to break the secrecy of confession to prevent a murder or other crime.;2276;IsNotPolitburo;767;0.97;1664548376.0
Someone makes a post in r/London thanking a couple of strangers on the Tube for defending them against unwanted attention. Naturally, this leads to drama.;560;Elderflowerspritz;174;0.96;1664533287.0
r/robbersgettingfucked is essentially shut down by the Admins after countless content policy violations. The Mods are not happy with this decision.;791;Walusqueegee;512;0.94;1664503747.0
/r/chess: the epic Hans Niemann v. Magnus Carlsen saga continues;730;Nysor;294;0.98;1664485318.0
What would you do if your OP was a rapist? OP wants to r/AskReddit what would you do if you found out your friend was a rapist, but a dive into OPs post history worries some users.;392;NoHandBananaNo;84;0.95;1664477314.0
Some Redditors Go Cross Eyed (Mary) and Blow Their Locomotive Breath When Lizzo Plays James Madison's Flute;2589;walkingdisasterFJ;642;0.96;1664470244.0
It's an unusually warm autumn day on r/PublicFreakout as things heat up when multiple users accuse OP of being a tankie.;126;PeanutCheeseBar;90;0.89;1664461513.0
A user in r/growingmarijuana post their setup that's ready to start growing, but some commenters are critical of OP's cleanliness and attitude.;442;hellakevin;125;0.97;1664459333.0
Sectarian conflict unleashes upon r/Christianity as users debate the ethics of the Catholic Seal of Confession in the context of reporting child sexual abuse.;314;JonSnuur;156;0.97;1664438551.0
Black Clover Slapfight transpires after users disagrees with a character showing ‘shounen tropes’.;75;Deep_Scope;20;0.95;1664428712.0
User in r/sexover30 laments sharing a kink with his wife. Another user claiming to be his wife shows up in the thread, having discovered his account, and confronts him. Post history reveals that the fantasy hole goes much, much deeper, with a real-life divorce at the bottom. WARNING: very NSFW;5306;SumTingWillyWong;500;0.98;1664408381.0
OP self drives into drama when he admits to doing 80 on auto-pilot with his hands off the wheel in r/idiotsincars;874;Chaosmusic;207;0.98;1664386358.0
Grim drama over Giorgia Meloni appears in r/Grimdank, and the Imperium's defenders rush to engage;775;ForteEXE;290;0.95;1664360475.0
Meta Pie drama when it comes to appealing to a broad audience in /r/berlin;147;accatwork;35;0.97;1664353972.0
It’s not about whether people know the difference. It’s a question of whether the difference matters and, in this case, it doesn’t.;71;34786t234890;26;0.88;1664317742.0
"r/TheTryGuys is in shambles after Ned ""I love my wife"" Fulmer alledgedly cheats on his wife with a staff member.";5480;Raichuchutrain;1014;0.98;1664286674.0
Does RRR Deserve Oscar Nomination? /r/r/r/India Discusses.;248;I-WANT2SEE-CUTE-TITS;178;0.94;1664285668.0
Someone has a Crisis over an LGBTQ pride logo on r/DCcomics;851;Mr_briskets;237;0.93;1664238550.0
