title;upvotes;author;comments;upvote_ratio;created
r/Libertarian discusses America's Aging Politician Issue;80;DonaldDuckJTrumo;129;0.94;1661245210.0
/r/UFOs is trying to preserve its legitimacy by making sure it’s photos are legit;300;Threedawg;93;0.93;1661228837.0
"r/KotakuInAction grapples with a difficult question regarding Sandman: is it possible for a ""woke"" adaptation to be good";2154;thefreeman419;743;0.96;1661228675.0
The hierarchy of slapfights in r/DC_Cinematic remains the same, as users rock each other over whether or not Dwayne Johnson's hoodie means he wants to be the lead of the DCEU;92;redbluebooks;17;0.93;1661224483.0
Darya Dugina, the Daughter of Putin Propagandist Alexander Dugin, is killed in a car bomb set up by the National Republican Army activist army -> Redditors debating whether there is an Insurgency Fomenting Within, Whether it was an MI6/CIA/Putin's Inside Job/False Flag, or if She Deserved It;386;DonaldDuckJTrumo;255;0.93;1661184524.0
"OP Posts a screenshot of a crashed ""Atlas"" on /r/NoMansSkytheGame. Doubles down when people call it out for being fake and refuses to give coordinates for proof.";182;Commander_Keller;41;0.95;1661181968.0
Minor drama on r/movies as one commenter defends Elvis against accusations of grooming a young girl.;350;PassiveAggressiveArm;183;0.96;1661177829.0
"OP in /r/conspiracy asks a simple question: ""What's the DEAAAL with all the Dem shills in here?!""";644;18CupsOfMusic;190;0.96;1661176717.0
"An Australian nightclub owner denies a drink being spiked. /r/Perth then argues when some users are also skeptical: ""The concept of innocent till PROVEN guilty does exist anymore in this believe all victims society""";1417;18CupsOfMusic;470;0.97;1661174619.0
What even IS hot chicken, anyway? A seemingly harmless question posed by a transplant from Alabama dredges up a slapfight or two.;678;buriednotmarried;231;0.97;1661128357.0
Slapfight begins in r/soccer over whether an own goal counts as a goal scored for a team. Do Manchester United actually have a goal this season? Find out in possibly the dumbest drama I've ever submitted.;157;ThatDBGuy;31;0.96;1661110801.0
A video of a father performing a Haka in an airport has OP and others getting into quite a few arguments over whether the Haka was as emotionally moving as the title made out, among other drama.;542;BlueTricity;168;0.96;1661109564.0
User posts on OOTL asking why they are being harassed. Proceeds to harass others who attempt to answer.;275;_Bob_A_Feet_;283;0.94;1661098954.0
"When a video of road rage incident involving a gun is posted, a firefight breaks out in /r/PublicFreakout: ""Awww someone doesn’t understand the concept of protecting one’s own life due to the dangers that exist in the world. Get over yourself""";1316;18CupsOfMusic;338;0.97;1661090439.0
Mini drama about cats, coyotes, and who actually lives in Raleigh...;67;theshoeshiner84;15;0.88;1661085392.0
Chess beginner asks a question, disagrees with objectively correct answers. Fight on r/chessbeginners ensues;1258;matbiz01;339;0.98;1661047980.0
We're off to see the Drama Wizard in the Emerald City as two users duke it out over HOV lanes in r/Seattle;65;ForteEXE;18;0.89;1661033909.0
Is Western Democracy as dead as Putin's Democracy? r/worldnews is in on the debate case;874;DonaldDuckJTrumo;385;0.96;1661014469.0
On r/Indianskincareaddicts, Redditor warns users to be wary of a particular scammer, story takes a turn as we find out the redditor in question is a bully, rape apologist and many more.;267;x-ihateithere-x;33;0.95;1660996576.0
An argument breaks out about culture and the San Francisco DA in r/DotA2 when a pro's passport gets stolen in the US. Is it even wise to leave valuables in plain sight or should it be a completely standard procedure to hide them in any country? Do SF cops not care about under $300 thefts?;122;CensarOfNensar;78;0.95;1660986631.0
Irish redditor attempts to defend alcohol consumption, strawman arguments ensue.;769;ajaxtipto03;220;0.94;1660981631.0
Mods of r/leetcode (a software engineering technical interview preparation sub) are found to have removed negative reviews of a paid interview preparation website.;299;lebron-is-the-goat23;34;0.96;1660938268.0
In r/HarleyQuinnTV, Joker may only be the second greatest threat to the Dark Knight. The first, according to one user's savvy soothsaying: socialism;206;SciFiXhi;113;0.96;1660934086.0
"r/libertarian Article: ""Free Speech Can’t Survive as an Abstraction"" -> """"Free speech absolutely means to be free to say whatever you want without any consequences."" So like, people shouldn't stop supporting artists if it turns out that they're wildly racist or homophobic?""";257;DonaldDuckJTrumo;134;0.95;1660931249.0
"""This whole subreddit is filled with imposter vegans."" /r/Vegan debates: Can you be vegan and own a dog? How about a cat?";821;18CupsOfMusic;717;0.95;1660930642.0
Prolific sunset posting user in r/Indiana reveals that none of his photos are from the Hoosier State.;1217;pm-me-your-bodyparts;83;0.98;1660930563.0
r/Jokes user makes a joke mocking feminism. Comment section is as expected;566;deleted;182;0.93;1660926289.0
Local r/196 user comes out as trans, only to be dumped by their boyfriend. Was this justified? Is OP a dirty liar? Users discuss.;1357;ShitbullsThrowaway;1240;0.93;1660921539.0
Minidrama as a restaurant stops catering to vegans due to their 'holier-than-thou' attitude. As if on cue, a holier-than-thou vegan shows up.;168;Birdy_Cephon_Altera;365;0.78;1660915180.0
Londoners debate the pros and cons of continued strike action my TfL (tube system in this case;31;bastardisedmouseman;4;0.79;1660912616.0
Does chicken need to be pat dry before cooking? A culinary discussion descends into potshots about who’s a shit chef;49;AppleSpicer;17;0.89;1660894841.0
"r/Facepalm discusses MTG'S "" Protect the innocence of children"" Act and things get heated very quickly";160;Capedbaldy474;94;0.94;1660893407.0
r/asklatinamerica gets heated when the president of Ukraine, Volodímir Zelenski, asks the countries of Latin America to stop trading with Russia.;1546;juanperes93;1061;0.95;1660864821.0
"OP in /r/PokemonGO thinks community days should last longer. Not everyone agrees. ""Just because the game doesn't bend to be whatever you want it to be doesn't mean it needs to change. You literally sound like a child.""";191;18CupsOfMusic;111;0.93;1660846549.0
"Germany refuses to back the EU's call to end Tourist Visas for Russians -> ""Germany has a new Hitler, Olaf"" and other debates on whether the Russian people abroad are no more innocent than Their Native Counterparts";333;DonaldDuckJTrumo;269;0.93;1660844950.0
“Here’s your chance Reddit, come collect your pound of flesh and comment on how shitty this recently dead celebrity was.” Users across 6 subreddits and 7 threads are divided over the death of Anne Heche.;813;18CupsOfMusic;362;0.96;1660843468.0
The old school lose their cool in r/OldSchoolCool over the Spanish Civil War;95;ForteEXE;50;0.93;1660819253.0
A right wing youtuber by the name of TheQuartering is supposedly contacted by the DEA regarding supposed allegations from r/TheQuarteringIsANazi subreddit. He and his fans are not happy and subsequently raid the subreddit.;2941;NerdyDank;646;0.97;1660805019.0
Users on r/Batman argue over whether or not the most popular Batman comics feature Robin;57;Mr_briskets;24;0.87;1660803391.0
One Piece fans get fed up with cosplayers posting their cosplays of sexy One Piece characters;403;schoolbomb;319;0.92;1660799102.0
A meme brings Jordan Peterson up, and the comments are as expected;498;Thayer1111;293;0.96;1660790265.0
"Canadian ""QAnon Queen""'s followers arrested after being told to attack cops -> Is BlueAnon real?";1426;DonaldDuckJTrumo;359;0.97;1660759209.0
A comment “Reddit hates women” causes Redditors to prove otherwise which spans more than 100+ replies in r/entertainment.;951;Angelix;437;0.96;1660715985.0
OP in r/mademesmile just got married, after having met his wife just one year ago at 18 years old. Commenters certainly aren't smiling, and instead opt to rip him (and those who share his sentiments) to shreds in the comment section.;2944;bermuda__;713;0.98;1660694768.0
r/Futurology debates the effectiveness of carbon capture, discussing an article where MIT Professor/Carbon Capture Expert claims that Carbon Capture is a dead-end technology.;93;Telphsm4sh;68;0.9;1660683327.0
Should Steve be banned from competitive play? r/Smashbros discusses if Steve is too good or if pros need to learn the match up;222;swisscheeseisvile;147;0.95;1660667366.0
"The ""Fluoride Wars"" start up again in /r/Portland after a user posts a meme comparing anti-vaxxers to anti-flouriders";587;boregon;229;0.98;1660665782.0
"Redditors up in Verbal Arms Race (up in arms geddit) when Putin boasts that Russian weapons are decades ahead of The West: ""I know that we like to rag on Russia and their follies, but we are currently in an arms race with Russia with hypersonic missiles."" -r/worldnews";194;DonaldDuckJTrumo;113;0.93;1660664116.0
"r/BestofRedditorUpdates does not take kindly to a self described ""schizoid antinatalist"" that disapproves of, then cuts off, his friends having children.";848;popkornucopia;435;0.95;1660662771.0
r/tinder argues over whether owning an iPhone SE makes you poor.;940;cazed_and_donfused;442;0.96;1660660160.0
r/MapPorn thread on the BRICS group fights over what Brazillian politicians (Lula and Bolsonaro) actually said about the Russian invasion of Ukraine. Accusations of lies, tankieism, and genocide denial abound.;50;derpwild;16;0.84;1660629496.0
A mod for Spider-Man Remastered that replaces Pride flags with American flags is removed from Nexusmods. Kotaku in Action have strong feelings about this, and multiple fights ensue.;2523;Logic_and_Raisins;645;0.96;1660615685.0
"""yup so just found out bout the aliens and how shrooms lsd dmt is a technology used to communicate with them holy fucken shjt""--OP makes a breakthrough in psychedelics research, but some r/DMT users are skeptical.";329;TheNeuronCollective;148;0.97;1660587246.0
Poster in r/TheWire convinced of symbolism in a scene from the show, The Wire, fights for his life to explain the Burger/Chicken meaning in the comments while being accused of being high.;164;NotProductive;30;0.96;1660576286.0
"Mass Looting Incident in Central London -> Politics/fighting/Brexit blaming/race/guns blazing on multiple subreddits: ""They voted to add more problems to our lives. Fine, that’s democracy. I’m still going to point out the problems.""";656;DonaldDuckJTrumo;356;0.96;1660576066.0
A modder replaces a pride flag with an American flag in the Spider-man game and people aren't happy. r/gaming discusses who the real triggered snowflkaes are.;765;akaispirit;365;0.95;1660555863.0
"""Love my vet buddies but I wouldn’t trust 90% of them with teenage girls lol"" r/JoeRogan has tasteful discussion about the kind of people in the military they are friends with. """;2865;DynamoJonesJr;653;0.98;1660550205.0
r/mapporn debates US and China;112;VerlinMerlin;166;0.91;1660542612.0
OP posts an LPT cautioning people against misusing words. Gets angry and defensive when people point out that he misused a word in the first sentence of his post.;692;Ttabts;121;0.97;1660492193.0
"The Inflation Reduction Act Passes. Reddit Reacts and scream taxes, the IRS and ""ackshually it doesn't reduce inflation"".";2144;DonaldDuckJTrumo;650;0.96;1660481882.0
r/GreenAndPleasant discusses whether a young 'tory' man deserved to die for saying a mean comment, subreddit mods are nowhere to be seen;314;SIR_CUMS_A_LOT_779;185;0.86;1660470794.0
Tankiejerk, a Popular Subreddit dedicated to making fun of tankies, starts purging liberals. Stalin Would be Proud.;680;BeeSlight2332;429;0.91;1660421548.0
A calm and rational discussion over at r/tooafraidtoask about body positivity, weight loss and the different pressures that society puts on men and women.;208;DynamoJonesJr;105;0.94;1660418203.0
"US announces ten-year program as part of Global Fragility Act to counteract Russian and Chinese Influence and Strengthen Democracy. Is this too little, too late, What about Their past bullshit in South America etc: ""Spare me, and everyone else your useless cynicism which you've mistaken for wisdom.""";49;DonaldDuckJTrumo;30;0.78;1660412334.0
Cool is lost as late stages of drama develop when slapfighting breaks out over RATM frontman criticizing capitalism in an old interview;147;ForteEXE;84;0.92;1660410044.0
Trump supporters threaten Civil War on TikTok in response to his FBI Investigation as well as a Conspiracy Theory of the IRS hiring 87,000 people for armed raids on tax evaders - some in r/politics: Are they serious, Does the Mainstream Media (MSM) truly believe this?;2612;DonaldDuckJTrumo;464;0.97;1660409746.0
America blacklists crypto service 'Tornado Cash', and the Netherlands arrests a developer on the grounds of 'facilitating money laundering'. Several Crypto subreddits debates if this is an invasion of privacy and is authoritarian.;635;StopHavingAnOpinion;165;0.97;1660394659.0
Lobsters find no amusement or sadness, only anger when a meme making fun of Jordan Peterson gets posted to r/FunnyAndSad;1785;ForteEXE;347;0.97;1660379334.0
A bit of artisanal micro drama from r/tvtoohigh;56;vi_sucks;15;0.89;1660377783.0
Can toothpaste fix the cracks in a relationship? Or is the relationship actually fine? A small drama in r/explainlikeimfive;314;goatfuckersupreme;37;0.96;1660332854.0
"""Yes I like blue rare, and MFF threeways and I have a betta, crucify me"" Some people in /r/steaks disagree about how rare a steak is.";1245;18CupsOfMusic;336;0.97;1660326790.0
Who Could Not See This Miniature Naming Drama in /r/sigmarxism?;199;Slinkusmalinkus;100;0.93;1660301353.0
Things get radioactive between Redditors as Russia causes damage to the Zaporizhzhia Nuclear Power Station and Threatens to Blow it Up with Mines. Should Ukraine blow it up Themselves, Is it part of a Masterplan to Get Money from cleaning up Future Radiation, Is this Time for Article 5 (NATO entry)?;1115;DonaldDuckJTrumo;292;0.96;1660298453.0
"When is a TikTok edit ""cringe""? Is it fair to criticize something that took someone time to do?";64;gonzotw;31;0.88;1660269707.0
This facepalm thread about a Daytime TV clip has it all: drama, homophobia, woman-hating, jumping to conclusions and of course food.... but were all of them deceived?;155;boyyouguysaredumb;15;0.91;1660260586.0
OP shows how crazy the Advisory business is, by misrepresenting his credentials and providing questionable information in r/investing;178;nomoneyjesse;18;0.96;1660256359.0
Wedding photographer interrupts first dance to say he's leaving, Redditor doesn't see the issue;304;bikinireef;89;0.95;1660242498.0
Discontent rising in /r/bettercallsaul as users argue about whether Kim Wexler has paid her price to society. (spoilers for the final season, obviously);67;lolecules;34;0.86;1660237108.0
Joe Manchin agrees to Sweeping #740 Billion Legislation Package To Raise Taxes On Wealthy, Invest In Climate ($369 billion in clean energy and climate investments). Redditors express shock and totally Healthy Skepticism;1457;DonaldDuckJTrumo;326;0.97;1660235466.0
On r/outoftheloop, a question about Ezra Miller sparks a conversation on pronouns. Of course.;380;deleted;165;0.92;1660222992.0
A polyamorous woman posts about her lack of success on tinder. r/tinder reacts.;2872;deleted;1862;0.96;1660215574.0
The r/aliceandfernsnark Drama: A Cohesive Summary.;72;Embarrassed_Clue_929;11;0.9;1660174598.0
r/GothamKnights discovers a pride flag in the background of a screenshot, and is horrified to learn that one of the Robins is canonically bisexual;1623;SS_Downboat;364;0.96;1660170397.0
"Should we gatekeep Climate Change activism? r/Unitedkingdom discusses whether only the ""good"" climate activists should be allowed to be heard.";93;StopHavingAnOpinion;68;0.89;1660167321.0
A Minor Mod, an AWOL owner, and a refusal to properly vet sources: r/aliceandfernsnark is the sub that keeps on giving;226;mayaic;31;0.95;1660163146.0
r/snails users get upset after OP leaves their snail in the sun;576;TumultuousTofu;191;0.98;1660142094.0
User in r/AmericaBad thinks that racism is mostly only an American problem. Argues with all who respond.;497;bermuda__;459;0.93;1660140422.0
Is adding black people into a video game political? Tonight on r/KotakuInAction, watch as they go into a little scuffle over the new Street Fighter character, Kimberly, a BLACK ninja who uses spray cans.;970;Dudelaser1;502;0.96;1660138657.0
Gaming's most famous femboy character comes out as trans. Some people in /r/GuiltyGear think that this is bullshit blazing.;2403;Khearnei;566;0.94;1660135529.0
"Who's the bigger neckbeard? Someone who jokes about dumping someone because they imagined him as a high school movie loser or the guy who makes a rape ""joke"" in response? r/justneckbeardthings discusses";87;IWriteThisForYou;5;0.81;1660107841.0
Trump's golf resort fortress of Mar-a-Lago was raided by the FBI. Was this all a political weapon instituted by those dang democrats? Why haven't they raided the Clintons? The real question is where about Hunter Biden fits in all this. r/timpool, r/conservative, and others discuss!;2503;Total_Strategy;580;0.96;1660077751.0
Poster on r/nanny believes a family has concerns with their dining habits. One poster believes they deserve a raise;87;hellomondays;103;0.88;1660068534.0
r/theboys implodes seemingly overnight over new mod rules;2769;DominioDreamer;399;0.98;1660062736.0
r/Creepy users express their hatred for yawning.;1553;ADHDavid;225;0.99;1660046898.0
r/MoviesCirclejerk pins post of a user wanting to see Comanche porn after watching Prey. Members question why the post is pinned, while OP accuses all who don't find it funny of jealousy.;354;Karthy_Romano;65;0.97;1659986854.0
A post advertising a girls only discord server is posted to r/leagueoflegends. The comments soon escalate with accusations of transphobia.;444;Mriamsosmrt;376;0.94;1659985323.0
Minor slapfight in r/OnePiece when OP posts a video of OP cosplayer, then, after OP fans question the realism of the OP cosplayer's proportions, OP jumps to her defense;177;insertusernamehere51;81;0.96;1659977568.0
/r/rabbits political propaganda has gone out of control;5295;RumAndTing;215;0.97;1659971377.0
"""Y’all hate how little it takes for a simple man to be happy."" /r/fakehistoryporn goes Paleolithic over Joe Rogan's obsession with cooking meat over an open flame.";593;18CupsOfMusic;220;0.97;1659959607.0
"""This subreddit is about crypto these things don't belong here this is not a Skittles package, Cardano is a solution to the old financial system not a company trying to be relevant."" A user posts a Pride-themed logo in a cryptocurrency subreddit. This causes a lot of controversy.";728;18CupsOfMusic;136;0.95;1659957377.0
A Rainbow Six: Siege player is TK'd for a pride character card.;495;StormFireTwister;124;0.96;1659916321.0
r/antiwork dukes it out with an OP who states people on the sub are just lazy and entitled;1060;sabasena;442;0.95;1659910515.0
"Mike Tyson is upset with Hulu. When some users are unsympathetic, fights break out over whether or not he is reformed and deserves forgiveness: ""I would have some sympathy if he wasn't a trash rapist.""";538;18CupsOfMusic;214;0.95;1659893220.0
AI generated artwork is flooding the art subreddits and it’s causing a lot of drama. Here’s just one example - it’s happening everyday though;2076;jspsfx;581;0.97;1659887789.0
"Can Nintendo games be ""dark""? /r/BikiniBottomTwitter debates: ""Well then I’m sorry it has to be said but it clearly comes down to how big of a fucking pussy you are.""";1532;18CupsOfMusic;546;0.97;1659874397.0
"A submariner tries to ""help"" someone by directing them to Google, ends up in a slapfight about slapfights";110;CaptainI9C3G6;18;0.92;1659866299.0
OP in r/blackmagicfuckery labels Kashmir as part of India. You know what happens next...;236;BattlefieldNinja;103;0.95;1659852739.0
A user comments on how sexy a picture of 2 dudes about to go Head-to-Head is and it turns out user is a conservative Christian. Some users at r/hmmm are not amused.;380;_kevx_91;108;0.95;1659842195.0
"An American basketball player is sentenced to 9 years in Russian prison for cannabis oil. When the US proposes a prisoner swap with Russia, /r/news is divided: ""She wants the US to give away one of the most dangerous men on Earth to save her career? Selfish wench.""";1566;18CupsOfMusic;549;0.96;1659820513.0
"Cycling ""Fred"" proudly posts his bizarre bicycle and gets roasted on no less than 3 different subreddits. He responds with insults, homophobic remarks, flexing his sports car, and general arrogance, leading users to hail him as ""the King Fred""";388;thumbsquare;73;0.98;1659815963.0
OP is left with Dry balls after his opposition refuses to fulfill a bet they made on GME (Gamestop Stock);186;SalmonTheSalesman;73;0.91;1659795897.0
OP and his GF worry about her sister's mental health and ability to function as an independent adult, so he asks Spain if they can force a mental healthcare intervention from abroad against her will. Symptoms include smoking weed, partying too much, and having an unstable source of income at 31 y.o.;2865;Mordisquitos;424;0.98;1659792021.0
The newest movie in the predator franchise “prey” meets with resounding success. r/movies discusses.;1256;Reader5744;497;0.97;1659761347.0
Someone on r/DCcomics is shocked to hear that Batgirl and Batwoman are different characters;219;Mr_briskets;111;0.95;1659744307.0
World of Warcraft updated their character creation from “male/female” to “body_type_1/2”;344;Qtpai;312;0.92;1659736966.0
Will the shop owner that stabbed a thief 7 times be in any legal trouble? The top lawyers of reddit are on the case;651;Molojin;804;0.97;1659736135.0
Seattle users duke it out once a poster implies a full-grown Husky in a homeless camp might be stolen;45;bermuda__;23;0.84;1659729231.0
Was Terry Davis talented? Is TempleOS impressive? Can he be blamed for his racism? /r/Programming argues over all that;130;playgrop;69;0.94;1659724767.0
Drama in r/parenting on whether it's weird for teens to sleep next to their parents. Bonus flounce.;190;Elderflowerspritz;73;0.97;1659722434.0
Coolguides fails to remain cool about Venn diagram of the North Atlantic archipelago.;38;dirtygremlin;22;0.81;1659717932.0
An intellectual DESTROYS Jordan Peterson on an online video platform, and r/jordanpeterson engages in intellectual debate about lobsters, polar bears, and the woke left.;4014;ThatDudeWithTheCat;1098;0.94;1659709242.0
"""[...]women are more likely to have the psychological profile rendering them incapable of being funny."" Are women funny? Do men suck at giving orgasms? Redditors in /r/meirl have trouble coming to a consensus.";1054;18CupsOfMusic;392;0.96;1659705682.0
40,000 years in the future, there is only slapfighting in r/Grimdank over alt-right fans of Warhammer 40,000;300;ForteEXE;285;0.94;1659678597.0
Conspiracy subreddit comes out to defend their favorite nutcase Alex Jones;2768;listen-to-my-face;415;0.97;1659641154.0
It's whites out and away we go! Drama in /r/formula1 as the Mercedes f1 team gives an update on their diversity and environmental impact goals.;150;The69BodyProblem;65;0.89;1659626025.0
Heated drama about judging books by their covers over in r/chemistry.;99;OvertheCounter_Beans;45;0.98;1659625983.0
u/shitmomgroupssay argues about whether or not cosleeping is dangerous. (Warning: the original post is quite disturbing).;1116;ThePinkTeenager;445;0.97;1659621651.0
Lesbian. Gay. Bisexual. Trans*. Queer. Only the Avatar can master all five elements and bring balance to r/LegendofKorra.;973;GodDamnTheseUsername;324;0.93;1659584400.0
r/conservative discusses Alex Jones' lawsuit, and how the democrats factor in.;2306;Total_Strategy;490;0.97;1659556658.0
Are the Republicans domestic terrorists? Is naming them terrorists calling for civil war? r/Ohio debates;1491;listen-to-my-face;330;0.94;1659540556.0
"Hi everyone, vintagethony dramtano here, the Internet's busiest drama nerd, and it's time to review r/Kanye's old drama over Fantano's re-review of ""My Beautiful Dark Twisted Fantasy"". Was it more articulate than the original? Someone's feeling a light to decent 6 on this one.";104;RedditsGadfly2;34;0.85;1659510304.0
Self-employed agricultural entrepreneur on r/restofthefuckingowl affirms that you, too, can become rich with free farmland, good philosophy, and a tax exempt tractor;629;Cabbagetastrophe;160;0.97;1659507415.0
Mamma Mia, the drama's become al dente when a poster rants about pasta on one sub then brings the drama to r/iamveryculinary;185;ForteEXE;70;0.96;1659483241.0
"/r/tf2 debates how to deal with problematic players, featuring the addition of racial slurs and homophobia. General response is to kick them from servers, but the ""older"" players have different views...";416;HardlyPartying;136;0.97;1659473590.0
r/TheLeftCantMeme suggests that it is okay to beat up a person with an LGBT flag based off of the flags meaning, leading to another user to question OP's comment.;2421;Sha489;595;0.95;1659468630.0
User proudly shows off his vehicle with several political bumper-stickers. Does not get the response he was seeking.;1432;slomotion;379;0.94;1659464747.0
r/TotalWar discusses gender neutral pronouns;333;allthejokesareblue;212;0.89;1659457413.0
"Was OP's boyfriend in the wrong pulling her out of a confrotation and telling her to ""calm down""?";336;txobi;196;0.94;1659392406.0
"Taylor Swift hits the #1 spot on the Carbon Emissions Chart when she is caught tailoring swift flights in a private jet. Some users in /r/Music are outraged: ""I literally don't care.""";3646;18CupsOfMusic;624;0.97;1659375951.0
