title;upvotes;author;comments;upvote_ratio;created
"OP in /r/antiwork has just one request: ""Can we get liberals and libertarians off this sub""";2591;18CupsOfMusic;1558;0.96;1664200149.0
"""Its not a political sub, please stay to the topic"" r/marvelstudiosspoilers mods delete and lock comments accusing Letitia Wright of being an antivaxxer";502;Biryani-Man69;217;0.95;1664178485.0
Drama when the zipper pull breaks on a Linus Tech Tips backpack;336;bikinireef;147;0.96;1664140134.0
Fans of the game series Forza Horizon disagree with OP's assessment of his real-life car's hypothetical in-game power rating and race to call them out in a tasty morsel of low stakes drama.;87;weirdassmillet;19;0.93;1664130756.0
A GameStop employee complains about parents using the store as a free daycare is told not to work at a store that appeals to children. A slapfight ensues.;974;marilyn_mansonv2;261;0.96;1664124871.0
Mods of r/RingoStarr purged, but is there more to it than regular mod drama? Romance, betrayal and intrigue as this developing drama plays out.;200;sewer-possum;68;0.96;1664123901.0
/r/fantheories user claims that Dumbledore is a time traveler. This gets complicated when OP claims that Dumbledore is having gay self-orgies everywhere, and then heavily promotes another book which might be his;2030;Fortanono;259;0.97;1664121578.0
Skyrim belongs to drama as fighting over a pro-Russia mod breaks out in r/Skyrimmods;269;ForteEXE;88;0.95;1664082108.0
r/CombatFootage erupts into a skirmish when a user asserts Afghani people don't use toilet paper.;160;deleted;122;0.91;1664075957.0
Nature becomes dramatic as r/natureismetal argues over CrossFit;75;ForteEXE;32;0.94;1664073077.0
A fun vs profit discussion on r/pathofexile leads to a discussion on the merits of the ultra rich and inherited wealth;73;_Violetear;25;0.92;1664069454.0
Low player base in Star Wars Battlefront 2015. tears are shed and alts are revealed.;74;thebrobarino;9;0.84;1664064264.0
"""Every citizen is responsible for their country's actions"". Estonia says it will not accept Russian refugees who are trying to flee the nation to avoid the draft. Subreddits debate if the Russians deserve it or not.";1138;StopHavingAnOpinion;921;0.97;1664040453.0
r/anime bursts into flames when mangaka convicted with child porn gets Anime announcement.;2087;3mium;521;0.97;1664038389.0
A man shields women from a shotgun pellet blast in Tehran. Users across multiple subreddits argue about America, simps, manliness, and...JK Rowling.;551;18CupsOfMusic;65;0.96;1664033818.0
The saga of G2 ESports's CEO and Andrew Tate comes to an end as the CEO steps down and r/leagueoflegends discusses;209;ForteEXE;50;0.95;1664002223.0
The downvotes and fighting are quite liberal as r/conservative reacts to recent Congress action from Republican Senators;2408;ForteEXE;371;0.98;1663986122.0
A response to Bite sized history about Portugal in r/badhistory leads to some bite sized drama in the comments when some take issue with with OPs fixation on some turn of phrases .;462;Spiketwo89;75;0.97;1663974087.0
Is it wrong to use artwork to train AI without permission? r/StableDiffusion gives their opinion and shows they definitely care very much about artists;384;Ragdoll_X_Furry;560;0.93;1663893407.0
r/China OP is not happy that his gym is spying on him big brother style;1945;GetOutOfTheWhey;232;0.97;1663872102.0
"[Small snack] Some residents are not happy in /r/comics with an author not opening their ""ears and eyes to real necessary criticism that you’re ignoring.""";162;Heydammit;55;0.94;1663869592.0
War is a drug, and r/stupidpol has the crash of a lifetime in a thread about Russia's mobilization;573;Bradley271;308;0.93;1663850822.0
Drama in /r/Valorant as it comes out that G2's CEO hanging out with TOP G might have been the reason they got denied a partnership spot;1289;Steelarm2001;294;0.97;1663844528.0
"""They are riding side-by-side when they should be single file. This is just inconsiderate at worst or just being oblivious at best."" Two people ride their bikes in the middle of the road. One person in a truck snaps a photo. Many users in /r/mildlyinfurating argue about it.";1186;18CupsOfMusic;656;0.97;1663777168.0
User in /PlexPosters does not take kindly to being called an alt. Is this a massive conspiracy? Is unddit a reliable source of evidence? Does this user care about the emotional well-being of their accuser? ~100 children posts will answer all these questions and more!;132;WaySmarterThanYouAre;19;0.94;1663744708.0
"""To defeat the far right, we should oppose voting for democrats"" - article proves controversial on /r/socialism leading to mass purges";2276;sansampersamp;1242;0.96;1663731855.0
r/ModeratePolitics debates whether using immigrants as political pawns is clever or atrocious;1635;Bradley271;659;0.95;1663611193.0
No memes, only drama in r/LeagueOfMemes as drama involving G2 ESports's CEO and Andrew Tate spreads;213;ForteEXE;27;0.97;1663539364.0
Moderators of /r/okbuddyretard announce that they will shut down the subreddit in a week...maybe? Subscribers are not ok.;1835;CrustyCatheter;251;0.96;1663531355.0
One user derails a thread in askNYC with his unique way of gauging neighborhood livability, and gives a new definition to the term “street food”;705;BravoAlfaMike;148;0.98;1663516515.0
Ocelote / CarlosR, founder and CEO of G2 Esports, is under fire from the community because of his friendship with Andrew Tate. r/G2eSports discusses;698;ohvalox;128;0.96;1663503970.0
Do fairy houses DEFILE and DESTROY nature? /r/Tucson decides.;164;AsAChemicalEngineer;93;0.95;1663493784.0
NBA coach Doc Rivers likes porn on twitter, including porn with trans women. Does watching trans porn make you gay? Is it homophobic/transphobic to make jokes about his porn interests? r/NBA discusses.;1533;BillFireCrotchWalton;295;0.96;1663488116.0
The Mods of r/paleontology ban gay dinosaur art. A civil discussion ensues.;379;Space_Lux;127;0.95;1663482961.0
r/JustUnsubbed just becomes dramatic over banning for participation in subs;335;ForteEXE;98;0.96;1663462319.0
Character creator options in Japanese games cause outrage across r/KotakuInAction;1324;better_logic;453;0.96;1663446534.0
One user over on /r/Bigfoot questions why the community dismisses claims of Sasquatch's interdimensional nature as woo;598;Phuckules;176;0.97;1663429614.0
Should members of the hospitality sector be drinking water in view of customers? Redditors battle over this incredibly important aspect of the restaurant experience.;1078;i3atRice;323;0.96;1663402268.0
"OP does sex work, but is her customer a jerk? Things get sour, not sublime, when a session goes 2 hours over time. Is it her fault for not saying ""halt!"" or is the client being defiant? Should their be repercussions? r/SexWorkers has a discussion.";596;BillFireCrotchWalton;253;0.94;1663395801.0
A man is stopped from robbing a restaurant. r/unexpected takes a stab at determining the morality of repeatedly jabbing a jagged plank in the failed criminal’s face.;169;Large_Talons_;60;0.95;1663379303.0
User in r/therightcantmeme insists that migrants at Martha’s Vineyard were bused off the island and is corrected…but refuses to back down and spirals.;450;Thisismypornaccountc;95;0.94;1663364838.0
Discourse over the pronunciation of GIF appears in r/technology;41;marilyn_mansonv2;64;0.82;1663343758.0
user of r/gaybrosgonemild posts photo of him in uniform, Trump flag spotted behind him opens the floodgates;824;carrie-satan;243;0.96;1663335801.0
"Ariel in the new Little Mermaid remake is black, and a user in /r/movies doesn't want to be a part of a world where ""it's not racist to remove white people form stories originating in white culture."" In the replies, poor unfortunate souls bicker over whether Ariel is white or a fish monster.";2151;MartinScorsese;870;0.94;1663332208.0
Roasted, mashed, and stewed comments when a Canadian replies to a response about buying potatoes in America;68;that_melody;27;0.9;1663318769.0
r/Persona5 has healthy discussions over consent in relationships between adult teachers and minor students;1296;SS_Downboat;456;0.96;1663305002.0
Who is the asshole? The gardener, the buyer or the developer. R/AITA debates at length...;43;Steelrain121;30;0.84;1663295817.0
"OP shows their ""troll"" side when comments aren't answering their question. How un-/r/civ-ilized.";171;Moskau50;44;0.95;1663297192.0
User on r/FFXIV claims a game subscription is predatory and a rip-off, argues with everyone in the comments on what they're entitled to.;828;mrcheez22;382;0.96;1663256518.0
Members of /r/WarThunder get into a slapfight over the politics and effectiveness of drones recently added to the game;158;YadMot;41;0.96;1663249815.0
r/TalesfromDF becomes r/TalesfromDrama as fighting over third party tools in FFXIV erupts;85;ForteEXE;81;0.87;1663246207.0
Ex-employee of training company shows up when the company offers free training in /r/MDGuns and notes that it may not be legal - pissing match ensues. Includes FB drama, copyrights, stolen valor, etc.;713;RevRagnarok;116;0.97;1663237688.0
"An r/oddlysatisfying poster shares a picture of his lawn with curved stripes. What follows is a discussion of whether rich people can be depressed; whether OP is in fact rich; the composition of his siding; dogecoin; McMansions; HOAs; how to sharpen mower blades; the morality of lawns; and pegging";1940;Feralpudel;363;0.98;1663203031.0
Gamers on /r/2007scape are furious about... [checks notes] NOT being insulted by a video game;991;Bioman312;185;0.91;1663160423.0
"a ""LGBTQ+"" user posts on r/CringetopiaRM calling out the mods of r/MadeMeSmile for locking a post regarding black children reacting to a black mermaid. Another r/CringetopiaRM user makes a separate post making fun of OP's use of neo pronouns, drama ensues.";652;Sha489;181;0.97;1663126553.0
A meme about Disney indoctrinating children, is posted to r/TerribleFacebookMemes. One user declares war by citing that they cancelled their Disney Plus subscription to stop their children being exposed to “Woke BS”;607;AstroCookieGalaxy;169;0.96;1663114458.0
What do interracial couples and IKEA have in common? OP hates both of them.;3249;Qtpai;615;0.97;1663104582.0
r/HumansBeingBros bestows “bro” status upon MacKenzie Scott for donating $55 million in real estate, along with billions more over the last few years. Some users, however, decide she’s just in it for the glory and/or tax write-offs.;446;hibryd;171;0.96;1663038474.0
A tank and a healer take their beef publicly on r/ffxiv. Receipts are posted, toxicity accusations are flung, WoW players catch strays, and did you know that Jerry Seinfeld dated a 17-year-old when he was 38?;1594;beary_good;374;0.97;1663031314.0
r/worldnews reacts to Swedish election results;992;derpwild;545;0.96;1663000518.0
Someone posts titanic satire with the gender roles reversed, triggers the entirety of r/funny;1078;oldmanshoutinatcloud;461;0.92;1662964891.0
Providence subreddit discusses news postings of dubious quality. Targeted user responds, long comment slapfight ensues.;32;piratedeathmatch;6;0.81;1662947057.0
"""Remembering Princess Diana, ✨🕊🤍 with Queer Fashion"" r/gay debates a person wearing black to commemorate Princess Diana, and the validity of the royal family";121;Ghost-Of-Roger-Ailes;14;0.9;1662937750.0
r/UCSD finds out a racist and misogynistic tiktoker is transferring to their college and wants to rescind him, the tiktoker in question tries to defend himself by pretending to be another person on an obvious throwaway;1796;Stazik57;335;0.98;1662931400.0
Young NBA star, Anthony Edwards, posts a video of himself making homophobic comments after he sees a group of men wearing sports bras. r/NBA discusses.;397;BillFireCrotchWalton;94;0.96;1662927814.0
guy seems determined to fistfight the entire /r/conspiracy sr over antivaxxers;236;gwstoss;69;0.95;1662924591.0
On 9/11, an anniversary involving the United States is observed not with mourning and silence, but slapfighting and arguing on r/pics;1150;ForteEXE;442;0.95;1662922074.0
"""You sound like a kid who just wants more free things and wants them with no effort."" /r/Overwatch is divided over the upcoming sequel's new Battle Pass.";1225;18CupsOfMusic;435;0.96;1662918988.0
"A small slap fight in r/Frugal over whether Northern Ontario counts as Northern Canada; The OP reveals they're from Mid-Northern Ontario which fuels the argument further";211;Isadoorian;37;0.97;1662870469.0
Are these genetically engineered, glowing aquarium fish for kids or adults? Two hobbyists debate the maturity of the average GloFish owner.;1078;kevlarbaboon;164;0.96;1662870050.0
[Snack] OP in /r/photography bravely disputes the dominance of two DSLR brands;262;audentis;70;0.96;1662804846.0
Who down-voted them? Microdrama over votes in r/horror;265;GLaDOSexe;107;0.96;1662779620.0
Flapsight in BestOfRedditorUpdates about whether women are more likely than men to have their reports of sexual harassment taken seriously;182;Endlessly_Diagonal;86;0.89;1662768033.0
A couple in New York City blocks a sidewalk with their car. A year later, Redditors argue about it over three different subreddits.;1004;18CupsOfMusic;321;0.98;1662760624.0
[snack] /r/NewVegasMemes OP makes a post about a modder's library, does not get the reaction he expects;623;FR4UDUL3NT;201;0.95;1662736364.0
"r/conspiracy user posts picture of a tweet claiming that the white house appointed a ""Satanist"" to an office. In a sharp turn of events, commenters heavily disagree and actually argue with OP in the comments.";1379;bermuda__;329;0.98;1662705345.0
r/AnimeCircleJerk bashes V-Tubers, but one user sees sexist undertones and scapegoating in their arguments;1333;NickelStickman;618;0.96;1662675198.0
Two normally inactive mods on r/QueensOfLeague removes the only active mod over a joke drama, users not happy;1085;DarkWorld25;114;0.97;1662649547.0
A pro player has a questionably named courier, his team gets penalized heavily and r/dota2 argues over the merits of it;179;ForteEXE;86;0.96;1662592091.0
OP posts an image of their dog's balls. OP does not want any advice about their dog's balls.;426;sirmeowmerss;122;0.93;1662582398.0
The Hans Niemann story: Cheating allegations, anal beads, and /r/chess;2284;TinyDKR;345;0.98;1662577594.0
Console wars explode on r/PS5 when it's revealed that Call of Duty will be on Playstation for only six more ganes;294;better_logic;170;0.94;1662576223.0
Mile high drama as one r/UnitedAirlines user calmly and bravely questions the order in which passengers should board the plane.;397;palkiajack;226;0.97;1662558468.0
"Are British ""people"" jokes going too far? r/196 discusses.";1670;DRlavacookies;1108;0.95;1662553815.0
Are British people transphobic? Is woke cancel culture too much? /r/synthesizers decides;686;AsAChemicalEngineer;461;0.91;1662497585.0
"""I'm already a better moderator, just lacking proper permission privileges."" - Someone decides to insult the moderators of r/emulation while asking how to become a moderator of r/emulation in a Weekly Question Thread.";225;AncientCarthage;74;0.94;1662488212.0
"""I’d rip all their shit up just on principle."" Users in /r/mildlyinfurating put their reservations aside to argue over a note on a set of public park benches.";1360;18CupsOfMusic;198;0.97;1662479405.0
Does baptism require the consent of parents for older kids? OP debates in shitstatistssay!;261;Islenator-;145;0.95;1662408130.0
Has the cure to cancer been discovered? Or is an 18-year-old college dropout being dangerous with his home chem lab?;1157;Googolthdoctor;306;0.99;1662388701.0
Andrew Tate attempts an AMA over at r/IAmA. It doesn't go well.;4282;HauntedFurniture;590;0.98;1662379454.0
r/Apexlegends discusses whether or not a 4-year old should be playing the game;148;Mrpresident01ssister;98;0.93;1662363119.0
r/196 gets in a subreddit-wide slapfight over wasps;651;FlameMech999;183;0.97;1662346581.0
Does any planet have rings or not? People in r/EscapingPrisonPlanet aren’t sure if Astral projection can be a trusted source. Not accepting earth has invisible rings means you’re “trapped and close minded”.;323;Marsailema;151;0.96;1662335649.0
Breaking r/news: Obama winning an Emmy causes slapfighting;261;ForteEXE;124;0.94;1662325993.0
Americans think everyone in r/BitlifeApp should know US cities regardless of their nationality;384;StudMuffinNick;251;0.9;1662308511.0
"""Rich nations owe reparations to countries facing climate disaster, says Pakistan minister"", Nationalists say Nope";1784;Educational-Salt-979;546;0.93;1662289032.0
Mild slapfight in r/mildlyinteresting over the safety implications of a rainbow fire-hydrant;281;JimmyCheeseoid;73;0.97;1662284595.0
r/WTF is in the water as a photo of a bath tub in Jackson, MS is discussed and things get murky on who is to blame for it;147;ForteEXE;26;0.95;1662278854.0
A user takes issue with the word “baddie” and has a right to teach OP the “right way” to speak.;923;Cereal_Bagger;213;0.97;1662245833.0
The drama takes off in /r/space when users argue about the incorrect use of the word “false”.;118;krully37;20;0.95;1662242731.0
A father celebrates his son saving up on his own for a vintage Bronco. r/MadeMeSmile says neigh.;1559;aduong277;1158;0.95;1662215019.0
Minor drama starts in r/gifs over if you call a BMW a 'Beamer' or a 'Bimmer' .;80;akaispirit;41;0.95;1662185574.0
Today’s r/news: Teacher wins $95k after being fired for misgendering a student. Redditors join the culture war again;758;saveyourtissues;539;0.92;1662183861.0
D&D5E releases a race of monkeys that were enslaved and then freed from transgalatic slave trade. People roll the dice to on their opinions as drama brews.;827;eisrinde;552;0.94;1662183151.0
Ex NBA player posts an apology in regards to past homophobic statements, /r/NBA debates whether “cancel culture “ is real.;130;death_by_retro;32;0.97;1662168465.0
"Drama in r/Residency as a user tells people ""political pins"" are bad, but mostly if they are liberal ones. A lot of arguments ensue.";281;abhi1260;179;0.94;1662151062.0
r/Steamdeck goes into a flurry when Dbrand's Project Killswitch underdelivers.;165;ShitbullsThrowaway;67;0.93;1662149942.0
OP in TIFU says he has been fired from multiple jobs for sexually harassing customers. The comments section holds his feet to the fire for being a creep with a questionable post history.;2736;SmytheOrdo;363;0.98;1662142089.0
r/skookum sees tempers flare when subreddit patron AvE doubles down on science denial.;103;iglidante;37;0.94;1662116932.0
A fight in r/tarantulas turns political;351;godchecksonme;55;0.96;1662112690.0
/r/iamatotalpieceofshit has an argument about soap and some dead fish (but mainly soap);113;See_Ya_Suckaz;44;0.91;1662103034.0
She Hulk's celebratory twerk-off incites drama across Reddit.;2504;deleted;1104;0.94;1662082388.0
r/conservative is having a meltdown after a Democrat wins Alaskas at large House of Representatives seat for the first time in nearly 50 years;6515;General-Programmer-5;989;0.97;1662031501.0
G*mers about the unhealthy obsession about what others do with their own genitals, the first amendment, and kicking people out of your neighbors house.;362;EtienneGarten;134;0.92;1662026428.0
"The last leader of the Soviet Union Has Passed Away. Reddit Sends Condolences and...you guess what. ""Where can we order our pizzas now?""/""But Black January""";506;DonaldDuckJTrumo;201;0.95;1662019081.0
r/devilmaycry gets into a slapfight over DmC and the definition of honorable;56;MistressDread;19;0.86;1662001549.0
r/advice’s advice is a unanimous f u, OP;126;Imaginary_Cow_6379;33;0.92;1662000070.0
Things get Fire Red in r/pokemontcg when one user corrects the info of the Op's post and another user incineroars on Op's behalf.;74;SomeFreeTime;3;0.88;1661999779.0
"OP in r/confidentlyincorrect claims plants are ""made of CO2"". Semantic arguments abound.";332;SciFiXhi;70;0.97;1661982033.0
"OP in /r/RocketLeague posts a video highlighting their teammate making a bad play. They do not get a very sympathetic response: ""So someone.akes a mistake and you decide to idle the rest of the match away. What a salty little bitch you are""";769;18CupsOfMusic;158;0.98;1661970815.0
World chess champion Magnus Carlsen goes on the Lex Fridman podcast, whose most popular guests happen to include Joe Rogan, Jordan Peterson, and Elon Musk, among others. r/chess debates whether or not this is a good thing.;876;BillFireCrotchWalton;295;0.95;1661923266.0
Racial drama developing over at Nottheonion after school enacts cultural policy.;385;oldmanshoutinatcloud;121;0.93;1661903537.0
OP gets all revved up when his loan application for a Mercedes sputters and breaks down;747;copy_run_start;141;0.97;1661884742.0
OP asks if $30 is being stingy for a wedding gift. Some take his side, but most call him out for being cheap.;1480;gordyNUT;733;0.96;1661878348.0
Drama in r/JonasBrothers when user inquires whether the band is still worthwhile;185;missdarbusisaqueen;65;0.93;1661826390.0
[ Removed by Reddit ];734;bikinireef;406;0.96;1661787474.0
"""Why do people like to justify shoplifting, like they're fucking Robin Hood?"" /r/unitedkingdom and /r/britishcolumbia argue over the ethics of shoplifting.";1974;18CupsOfMusic;953;0.97;1661782589.0
Stardew Valley content creator, UnsurpassableZ, gets called out on his subreddit r/UnsurpassableZ by subscribers and mods. They are accusing Z of ignoring sexual harassment allegations made against one of his mods (IRL friend), not respecting people's pronouns, being a misogynist, & being a bully.;2244;InanetV;323;0.93;1661695240.0
The ring bell is sounding in r/LivestreamFail as a leftwing streamer is challenged to a boxing match by an alt-right comedian;670;ForteEXE;459;0.93;1661668509.0
"""Have you ever watched a Swedish TV show? An Ugandan? An Indian? A Chinese? Do you really think these shows feature a very diverse cast?"" The drama is stuck in second gear after the creator of Friends donates $4 million due to ""guilt"" over the show's lack of diversity.";1481;18CupsOfMusic;501;0.95;1661645622.0
Anthony Fauci Announces Retirement in December 2022. Reddit reacts in The Most Totally Rational Way Possible;1488;DonaldDuckJTrumo;302;0.96;1661591790.0
Mod drama in /r/footballcards, where the only moderator is mocked with poorly photoshopped football cards insulting him.;930;NakedMuffinTime;78;0.98;1661562375.0
Also, YOU ARE AN UTTER SPINELESS CREEP FOR SIFTING THROUGH MY COMMENT HISTORY LOOKING FOR MATERIAL!! Spat over whether you should leave your friends over a phone;271;Saigot;54;0.92;1661556146.0
New Apex Legends Player Offers Reminder to be Kind, Comments Offer Rebuttal;356;DorkyBaller;77;0.96;1661552050.0
Minor drama in /r/forzahorizon over the quality of a Ferrari model;93;tzanorry;21;0.94;1661533185.0
Popcorn flies as redditors debate whether or not Finnish PM Sanna Marin was cheating on her husband while partying.;368;popkornucopia;222;0.94;1661526053.0
"Russian Media declares Trump ""Their Agent"" and that He is Being Persecuted. -> ""Let’s prisoner trade Trump for Brittney Griner"" and other downvoted comments and fighting";1828;DonaldDuckJTrumo;230;0.97;1661504093.0
r/Games has lengthy non-stop arguments over whether or not Gotham Knights is part of the Arkham franchise;318;SS_Downboat;140;0.95;1661464672.0
"""""Innocents pay for war. You see what happened to Darya Dugina? She paid the price for the war"" is all Pope Francis' saying. The title took what he said out of context. Alas, anything in regards to the war is highly charged to the point where dialog is pointless"" -Fedoras and defenses put by Reddit";202;DonaldDuckJTrumo;125;0.91;1661439302.0
"Erdogan announces Ukraine Must Reclaim Crimea...but what about Cyprus And Armenia? ""Putin-Erdogan bromance over"" -Redditors";148;DonaldDuckJTrumo;63;0.93;1661436463.0
Commenter makes a joke about OP divorcing their husband due to placing the TV too high in /r/tvtoohigh. Chaos ensues.;1683;Brundlefly_86;304;0.97;1661433401.0
User in r/idiotsincars snaps a photo of a car with a blocked rear window. A lot of other users disagree as to who the idiot is. OP gets defensive about his own driving;297;AnustusGloop;76;0.97;1661429838.0
Wedding Photo posted to /r/weddingshaming. Bride and at least one other user who claim to have been at the wedding comment enough complaining about it that the mods had to block all comments;587;tweedyone;186;0.97;1661371475.0
"""I unironically would support impeaching Biden over this"" Neoliberal debates and reacts to Joe Brandon signing an executive order forgiving $10,000 in federal student loans";3512;Cupinacup;1943;0.95;1661363628.0
Did Alexander the Great lose a battle to Indian forces? Or is it just a 20th century conspiracy theory? Or are all of the sources in favor of Alexander biased and unusable? r/AskHistorians debates!;326;Idk_Very_Much;140;0.95;1661347051.0
If a 50-lb dog tramples your 5-lb dog at an off-leash dog park and you don't pepper spray it, does that mean you're the type that coddles criminals?;1532;surprisedkitty1;570;0.97;1661327264.0
"""No, what I'm expressing is my disdain for you while I'm shitting my guts out on the toilet bowl"" - An exchange on writing in r/worldjerking goes on, and on... and on...";602;bhbhbhhh;207;0.97;1661302509.0
r/justunsubbed cant agree if its gif or jif.;73;FoggyFuckNo;88;0.88;1661284217.0
One brave conservative Muslim on r/television bemoans the depiction of liberal Muslims in response to a new TV show about a Palestinian refugee;585;BillFireCrotchWalton;255;0.95;1661276663.0
r/DCComics discusses when it's ok to use the N word;495;Cranyx;235;0.95;1661263158.0
The Merry Men of r/Damnthatsinteresting discuss the ethics of stalking and mugging social media influencers;227;insertusernamehere51;113;0.96;1661256771.0
r/thelastofus2 discusses how pretty a 14 year old girl's face is supposed to look;1468;bayonettaisonsteam;350;0.95;1661252621.0
