title;upvotes;author;comments;upvote_ratio;created
An American asks /r/Dublin where he can get some REAL American food, like REAL burgers or cute waitresses.;45;Ynwe;53;0.91;1674145312.0
"r/joinsquad goes to war with the devs and itself after they drop a bombshell stating the addition of emotes and ""future monetisation"" in the upcoming versions";30;SirDanks-;28;0.91;1674133972.0
User really wants the rest of Reddit to stop judging samurai for randomly killing peasants, citing cultural differences.;166;AlbinoMetroid;147;0.96;1674129386.0
Should you pay for someone's food if the person in front of you does? r/ToiletPaperUSA discusses;14;V_For_Veronica;5;0.7;1674114125.0
"Welcome to this brand new episode of ""r/Conservative Discusses SWFs (Single White/Woke Females)"", where the girlfriends are made up and (alas) the boners don't matter.";762;NandiniS;404;0.96;1674068064.0
r/Overwatch discusses if getting auto muted for voice line spam is right or wrong since voice lines now can cost money. Hidden in all the voice line spam there’s popcorn;122;TheGlassHammer;101;0.94;1674065007.0
/r/kotakuinaction Goes to battle when the new fire emblem doesn't allow romance with under age characters;1538;2ddaniel;678;0.95;1674063107.0
Is PETA really evil? Is PETA actually good? Was it a clever comeback at all? Things heat up as people discuss PETA's actions and if they are as bad as the media makes them out to be.;554;ModernCaveWuffs;400;0.94;1674052953.0
Console wars explode on r/PS5 when it's revealed that a pair of ancient RPGs run better on Xbox;164;better_logic;156;0.89;1674022955.0
Major EDM artist cancelled after allegations of grooming minors announces comeback. R/bassnectar discusses;144;crackyboi;96;0.94;1674019752.0
Ivan Provorov refuses to wear a pride jersey for the warmups at pride night in the NHL, citing his religious beliefs, causing r/hockey, r/NHL, and r/HockeyPatrolNews to spontaneously combust;334;Professional_Ship107;534;0.93;1674018303.0
OP in r/tifu makes the mistake of being poly;314;sewer-possum;220;0.87;1674003344.0
Birthday pizza loaded up with tuna, cream cheese, and sexually-charged personal attacks;246;HGpennypacker;113;0.95;1673987535.0
Some light drama on /r/OnePiece when one user names their child after a character in the manga and other users react;1152;schoolbomb;624;0.96;1673983479.0
To return the cart, or Not to return the cart? That is the question r/RandomThoughts is asking. A few users take it personally.;709;Purple_Tuxedo;407;0.96;1673932496.0
OP decides to tell the 'truth' about ex-SNSD member Jessica Jung's books on r/kpopthoughts. Debates about Jung's (and OP’s) motivations ensue.;258;leqant;65;0.91;1673904614.0
HistoryMemes users string each other up over what is and isn’t vigilantism;149;Sokos69;46;0.94;1673896065.0
Users in r/PCGaming argue whether the amount of likes on a video makes the YouTuber more correct than dissenting opinions by non-YouTubers.;762;Cereal_Bagger;139;0.94;1673894634.0
Lengthy grammatical slapfight in r/buildapc;75;government_shill;44;0.91;1673830956.0
Minor but popcorn-fueled Jay Leno / Gigantism drama in r/CrusaderKings;210;bermuda__;54;0.96;1673825449.0
OP gets sliced in the comments after his pizza post in r/Portland gets panned and reposted to r/PizzaCrimes.;1113;BillFireCrotchWalton;484;0.97;1673815261.0
Redditor on r/WorldNews gets fed up with karma farming comments, WorldNews users disagree and comments devolve into insults and a new washing machine.;147;Edselo;81;0.93;1673802404.0
"Streamer playing Escape From Tarkov abuses community helper role to ban someone who he accuses cheated. ""Cheater"" makes a post in the subreddit uploading his POV. Drama ensues.";1394;RTBBingoFuel;152;0.98;1673779393.0
"Polish MMA fighter sucker-punches Youtuber during an interview, allegedly in retaliation for Twitter insults. /r/CrazyFuckingVideos asks: ""Was it justified?""";152;CrustyCatheter;50;0.98;1673758135.0
r/RimWorld user recreates a map of Earth in-game. Drama ensues when some notice OP populated Africa with savage cannibal tribes and pirates.;794;metrocat2033;234;0.97;1673754159.0
"User in r/bigdickproblems disagrees with the statement ""100% of your DNA is from your parents""";2047;SciFiXhi;428;0.98;1673744153.0
Does rural weight weigh more than city weight? Who's grandad could win in a fight? Long argument chains over if 1kg in a field weighs more than 1kg in the gym. But it doesn't matter because your probably take steroids anyway.;534;Big-butters;189;0.96;1673709205.0
OP asks /r/Christianity if being gay means they deserve eternal torture. With 37 upvotes for 600+ comments, /r/Christianity has some thoughts;1677;dolphins3;625;0.96;1673679876.0
r/chevy user posts a video of their truck flying the Confederate flag. Gets down voted into oblivion.;471;MHTBravo;154;0.95;1673653746.0
On r/notlikeothergirls, some guy gets...really angry. Like, REALLY angry.;268;myassisa;115;0.94;1673653248.0
r/Arkansas becomes not the Land of Opportunity, but the Land of Drama over a billboard campaign;84;ForteEXE;48;0.9;1673648497.0
Is the US a third world country? Can Reddit users understand hyperbole? Should we put pedophiles to death? r/TrueCrimeDiscussion uh...discusses.;177;piratedeathmatch;201;0.9;1673636505.0
OP in r/antiwork gets 5k+ Upvotes for a letter to management comparing them to Auschwitz. Comments are not amused.;1947;sternburg_export;524;0.97;1673633196.0
What is Ireland, exactly? It's not always sunny as /r/IASIP tries to figure it out;233;bikinireef;103;0.95;1673622003.0
Redditor makes a post criticizing the head coach of the team on r/Steelers. Drama arises when OP admits to ignoring their family just to watch the Steelers;203;ImpressSilent;73;0.96;1673569920.0
"HBO's ""The Last of Us"" TV adaptation is getting good reviews";1118;bayonettaisonsteam;514;0.95;1673552689.0
In an AskReddit thread concerning bodycount numbers, a man gets accused of lying, and forgets his post history is public.;476;jarockinights;255;0.97;1673537537.0
OP posts a picture of a bootleg The Office DVD, /r/mildlyinteresting users disagree;139;Anaklusmos;44;0.94;1673536878.0
Andrew Tate - Sex Offender or an innocent man being set up? Is it okay for an adult to have sex with a 16 year old? And is everyone in France a paedophile? r/conspiracy discusses in all its glory;2591;GeeSlim1;682;0.96;1673524307.0
r/nfl has a thread about race. It goes about as well as you would expect.;316;graywolt;192;0.92;1673490778.0
r/bayarea discusses if it’s okay to spray a homeless woman if she won’t leave;1284;derpwild;1220;0.95;1673454306.0
A meme concerning Irish-British relations is posted on r/2westerneurope4u. Chaos quickly ensues.;596;allenthalben2;362;0.96;1673438066.0
r/MarvelStudiosSpoilers complains about a comic book character......being too comic book accurate looking?;233;Biryani-Man69;100;0.93;1673401574.0
Humans of r/humansbeingbros quit being bros for a while after noticing that a person in a TikTok went to prison at the age of 16 for killing somebody over $40;1887;bermuda__;765;0.97;1673369564.0
After a content drought in December, the Vtubers of Hololive Production has a full scedule for January, but not everyone is happy.;195;I_Eat_Pork;180;0.9;1673364670.0
Ellie is a 14 yr old girl in the game the Last of Us. Actress Bella Ramsay will portray Ellie in the live action adaptation. A g*mer swaps Bella's face onto Ellie's character model to have reasonable discussions about Bella's cuteness vs Ellie's cuteness;2251;tikaychullo;728;0.95;1673305828.0
A small bout of drama on r/totalwar on the best way to fight khorne;58;Okdudeeeeeeeeeeeee;58;0.93;1673283113.0
"/r/PublicFreakout audits ""First Amendment Auditors"" - are they heroes or menaces? Scholars politely debate in the comments.";125;Tomotronics;317;0.96;1673282585.0
r/starterpacks OP strikes a nerve with their mockery of comic book store patrons;230;GodSpeedLightning;128;0.94;1673281959.0
r/gaming complains about gamer's chair not being comfy looking;252;Biryani-Man69;150;0.93;1673274252.0
The r/Art AI controversy is settled....;367;Uhfolks;431;0.56;1673270904.0
Witches vs. Exmormons: A Tale of Two Threads;219;Schjenley;125;0.94;1673232249.0
r/drugs user asks what substance he can abuse to fix his anger issues, loses shit at comments suggesting therapy;764;ChairmanEris;167;0.97;1673216774.0
Drama in r/Fighters as one user asks why more people don't try Them's Fightin' Herds;114;MistressDread;74;0.94;1673213097.0
Entirely unexpected drama arises in wallstreetbets when a user loses everything.;448;Sheyren;85;0.99;1673198505.0
r/Splatoon player just found out squid ink is real. Accuses those making fun of him of being culturally insensitive to Americans;2221;insertusernamehere51;428;0.98;1673196693.0
A little amuse bouche of Cajun drama in r/seriouseats;90;justcurious12345;26;0.93;1673135666.0
r/teachers makes a poem about student excuses. Some users aren't amused;194;ExraSoftHandker;199;0.92;1673124561.0
The Strange Sad Tale of DrunkOniDaughter;254;Barelybipolar;46;0.94;1673122317.0
The artist from the famous “AI looking drawing” in r/Art has come back and decided to retaliate against the mods!;2947;Hshshshhf;742;0.98;1673107339.0
r/TheLeftCantMeme gets upset over anti-Harry Potter memes on r/gamingcirclejerk, and calls everyone who doesn't Harry Potter a pedophile;806;SS_Downboat;432;0.93;1673066262.0
Hooters and incels and simps - oh my! When a Hooters waitress shows off her weekly tips, a lot of people get mad for various reasons.;1757;lemon_meringue;600;0.95;1673049237.0
A quarrel on r/geology as OP arrives asking for assistance ascertaining how astrological his rock is and doesn't acknowledge their answer.;766;RyukuGloryBe;115;0.96;1673024332.0
In a post about a Gucci ad from 1997, two Redditors have a civilized debate about whether the long-haired man in the ad's background is Asian or White.;333;CaptLeaderLegend26;231;0.96;1672999517.0
Star_Trek ban forces users to go boldly where no man has gone before (places other than reddit);973;FWB4;737;0.97;1672967175.0
Competitive Pokemon site Smogon barely allows Terastallization to be fully legal by only a few votes. /r/stunfisk reacts.;504;NyquilBasedBroth;255;0.96;1672950329.0
"A dude is vomiting daily. He's reluctant to go to the doctor because of financial reasons and ""close to my family becoming homeless"". Despite this he's spending enough money on weed... to make him sick because otherwise he has no appetite.";1456;The_Pale_Blue_Dot;436;0.97;1672932670.0
An innocent question about the name of a line of reasoning in r/askphilosophy turns into a slap fight over whether one user was being condescending in their reply, or whether they were misinterpreted, possibly because of their autism;56;_LususNaturae_;27;0.89;1672923875.0
A r/Morocco user asks why he's not seen as Moroccan in Morocco, drama ensues;178;deleted;130;0.97;1672922850.0
/r/art has gone private following recent drama involving one of its moderators accusing and banning an artist for posting AI art;3073;AI_Characters;962;0.99;1672912732.0
Minor drama in r/Metaldetecting as one user suggests an outdated metal detector. Insults and dissuasion of procreation follow;84;Edselo;25;0.96;1672890159.0
An r/Overwatch user has a very controversial balance suggestion.;384;Yuni_smiley;153;0.95;1672870935.0
Is a point a circle? Mathematic antics and geometric groans galore in /r/blursedimages;222;umbrianEpoch;121;0.97;1672863594.0
A post about a fake information point devolves into a slap-fight about the Mohs rating of opals;101;freeeeels;44;0.94;1672856017.0
A minority of people argue with everyone else over the definition of the word “majority”;315;case_8;104;0.97;1672851308.0
VOTE for the best drama of the year in our Bestof2022;89;DramaMod;38;0.88;1672849934.0
In the state of Louisiana websites such as Pornhub now require a state ID or drivers license to be provided to a private company for the privilege of porn. Leave your Zatarans boil mix and Tony Chechere's at home, there's plenty of spice already here.;1749;TchoupedNScrewed;865;0.98;1672820210.0
Some mini drama in r/preyingmantis when two users argue over an offensive word in a 2 year old comment;591;3FrogsInATrenchcoat;115;0.96;1672804187.0
r/UKpolitics mods suspend megathread indefinitely to address low quality posts in general submissions and reopen it the following day. Regular posters are confused.;551;Momeberry;297;0.96;1672742536.0
100+ comment argument in r/opisfuckingstupid on whether OP is actually fucking stupid;355;bermuda__;35;0.96;1672732847.0
"American user posts their 23andme-results to r/Nordiccountries claiming to be ""half ethnically Scandinavian"". r/Nordiccountries is not impressed.";1907;L4r5man;1144;0.97;1672691616.0
"Try not to get CTE after this short concussion-related drama in r/CFB. ""Mate, I hope you didn't actually attend Harvard""";57;ron-darousey;15;0.89;1672625357.0
OP does not respond well to a commenter pointing out the math error in their r/datascience visualisation, commenter proceeds to doxx OP and someone else;2246;DeepSeaNinja;180;0.99;1672622064.0
User in r/Genshin_Impact brings their body pillow to dinner at a Chinese Restaurant. Commenters are torn between it being cringe or a chad move.;980;explorer_76;187;0.98;1672619231.0
Redditor rushes to defend Elon Musk's honour in /r/ImTheMainCharacter;1149;sirboozebum;299;0.95;1672612938.0
User in r/AdviceAnimals calls for civility in 2023. Commenters see this wish as enlightened centrism and come out swinging.;466;SciFiXhi;282;0.95;1672604856.0
New Year's Eve slapfight when one user in r/FanTheories attempts to solve the mystery of a burning painting in Glass Onion (spoilers for Glass Onion);318;bfsfan101;75;0.94;1672582774.0
After a user in /r/JustUnsubbed leaves /r/gay for that sub's opposition to the Gays Against Groomers group, a slapfight ensues over whether the group is a right-wing dogwhistle or not.;1280;NyquilBasedBroth;425;0.96;1672548503.0
/r/Scams has a little spat when the owner of paywithmoons.com shows up to defend their product;165;ChristianSingleton;32;0.94;1672538217.0
Drug drama round 2 in r/leagueoflegends as a major organization terminates a contract;63;ForteEXE;3;0.93;1672518668.0
"Please sir, may I have some more? A short slapfight when a user on /r/neoliberal complains that his $450k/yr household income in NYC feels ""middle class.""";569;Cupinacup;268;0.96;1672517917.0
One poster has a bad experience with the IRS and tries to get people to sign their online petition to fix the IRS. Multiple slapfights when commenters tell them this won't work and their ideas don't make sense.;191;BillFireCrotchWalton;39;0.95;1672515444.0
Why does Reddit hate guns?;134;neuroticsmurf;51;0.79;1672514324.0
It's Christian vs Conspiracy Theorist time in r/Conspiracy as a Jesus follower tries to spread the gospel in a 1000+ comment post;833;Primary-Tomorrow4134;177;0.97;1672501160.0
(r/VindictaRateCelebs: in a post complained about racism toward black women) Some women started arguing and belittling others' appearance (it even got transphobic at one point) and then use the number of men's DMs per min to bring each other down;325;No_Crow_6076;107;0.89;1672461848.0
Long slap fight over altruism, nihilism, and alcoholism in r/natureisfuckinglit;697;goosechaser;147;0.95;1672429013.0
Two users quickly devolve into a slap fight of insults where no one is allowed to get the last word. Be well!;92;Wires77;62;0.85;1672408865.0
Romanian authorities arrest Andrew Tate and Reddit Tater Tots react;3249;ForteEXE;757;0.96;1672363710.0
A trans woman has been cast as a trans woman in the One Piece English dub. Fans argue whether or not representation matters;747;schoolbomb;213;0.94;1672361039.0
Op becomes the main character in /r/Imthemaincharacter after posting an image that does not fit into the sub. The twist op is a mod.;393;mynameisalso;78;0.96;1672314937.0
an r/nhl member makes a post about Alex Ovechkin's picture with Vladimir Putin, spawning a shit-tornado which picks up and throws around accusations of terrorism by Ukraine, Russian apologists, and friendly debates between pro and anti-Ovi hockey fans;106;Professional_Ship107;27;0.93;1672287239.0
R/Art mod accuses artist of using AI, and when artist provides proof, mod suggests that maybe they should. Wave of bans follow as people start posting that artist's work and calling mod out.;3342;RavensDagger;835;0.99;1672279271.0
"Things get heated in /r/justneckbeardthings about whether the insult ""Small Dick Energy"" is body shaming";1803;Any-Environment-17;1689;0.96;1672269417.0
Guy in r/cars buys a bad electric car. Gets very upset when people point that out. Has been going for 8 hours now...;260;mrknife1209;66;0.96;1672216145.0
"""Stop complaining,"" says billionaire investor Charlie Munger. ""See you in SRD,"" says /r/neoliberal.";1327;Spaceman_Jalego;922;0.94;1672196705.0
A photo of the Boston skyline being visible from Cape Cod is posted to /r/mildlyinteresting. A flat earther then shows up in the thread with interesting mathematics;455;Dragonsandman;101;0.98;1672174122.0
OP snaps at helpful commenters on r/AskCulinary trying to give advice on deviled egg preparation;98;mikonamiko;46;0.92;1672172834.0
User on /r/starterpacks really doesn't like it when people wear pajamas on a airplane;312;techiesbesthero;232;0.96;1672153245.0
OP in r/FunnyandSad thinks women wanting to walk safely at night is sexist;1678;gallerton18;492;0.94;1672150154.0
[UPDATE] A scammer tricks another redditor into sending him a cactus but he doesn't pay for it, he then makes multiple posts in r/sanpedrocactus calling the VICTIM the scammer. The victim then posts screenshots of their conversation which reveals the truth, and the scammer gets banned;679;Thewallinthehole;87;0.97;1672149683.0
Cosplay drama rears its head in /r/OnePiece once again when cosplayer is attacked for low effort cosplay;820;schoolbomb;320;0.94;1672118166.0
Trust me, I’m a lawyer;63;slaymaker1907;10;0.77;1672077169.0
Redditors argue about who has the red flag as a security suard pushes a player's girlfriend during a proposal.;232;Mttecs;27;0.94;1672074453.0
A moderator of r/okbuddyhololive tried to remove two active top moderators through r/redditrequest. He ended up being the one removed.;104;ModeMex;38;0.9;1672040314.0
r/FuckImOld bans content from after 2005, resulting in a debate over who has the right to feel old;1580;GriffinFTW;232;0.97;1672038471.0
r/conspiracy discusses The Holy Ghost and just regular ghosts as they put the Christ back in Christmas;227;Imaginary_Cow_6379;60;0.95;1672023825.0
Is going to your child’s event something a good parent does? One redditor decides this is his hill to die on;200;trifflin-quagsire;49;0.95;1672023715.0
In celebration of the greatest European basketball player’s career, a heated argument about whether selling drugs at lower prices is good for customers;51;qlube;13;0.85;1672019303.0
An /r/Denver resident reminds people to tip their servers and bartenders well for working on Christmas. One user decides takes umbrage with this.;952;i_heart_calibri_12pt;151;0.96;1672015096.0
Drama in r/London on whether investment bankers are the most hardworking people in the world;366;Elderflowerspritz;160;0.96;1672003360.0
A Minnesota Vikings fan posts a video poking fun of the Detroit Lions. Most commenters have friendly discussions about sports. But, OP proceeds to argue with any Detroit Lions fans derailing the thread.;123;Islenator-;33;0.95;1671987396.0
An /r/pics post with photos of two adorable puppies hugging couldn't possibly generate drama, right? Well, OP said he could only adopt one. Name-calling ensues.;655;civver3;158;0.96;1671978890.0
OP’s top post in r/pics goes off the rails when sleuths find old comments indicating that her husband is a major asshole;1503;the_internet_police_;273;0.98;1671956853.0
Tis the season for legendary drama of varying leagues as r/leagueoflegends gets into slapfighting over a coach's performance in ranked gameplay;48;ForteEXE;27;0.89;1671954925.0
A post on /r/youngpeopleyoutube shows a comment on a video with Andrew Tate that the OP liked. Commenters offer their mixed opinions.;349;shiza-salad;62;0.95;1671926320.0
Diapers need changing when a user takes a stance against the body-shaming of someone that he hates, which quickly derives into a philosophical argument on the nature of hypocrisy;313;Mordisquitos;114;0.95;1671924642.0
Slapfight in /r/natureismetal as users get ready to rumble over whether Mike Tyson could take a chimpanzee in a fight;209;Gamiac;104;0.96;1671920943.0
A user asks for passport help and then attacks every single commenter in the thread;507;weshallbekind;135;0.98;1671891252.0
[Snack] Is it unlucky to be randomly stabbed? A user in /r/unitedkingdom finds the terminology irksome.;54;Fiennes;6;0.91;1671890603.0
/r/HarryPotter has banned all discussion regarding Prof Snape vs James Potter because people are going buck wild and resorting to personal attacks.;2674;L0NESHARK;1189;0.98;1671878735.0
User comments that they eat Ferrero Rocher Candy in two bytes, calamity ensues.;128;Coding-Kitten;63;0.88;1671847858.0
Popcorn time over on r/marvelmemes as a Stan Lee quote about keeping 'social issues' in the background generates drama;313;Alexdoh;117;0.95;1671845825.0
A r/battles2 player is accused of cheating by one of the best players in the game. Said player shows up with multiple sockpuppets to defend themselves.;114;IAbstainFromSociety;21;0.96;1671832973.0
A r/personalfinance user posts about his credit card being weeks from a charge-off. After they reveal that they're intentionally not paying the minimum payments, everyone else flames them.;261;IAbstainFromSociety;52;0.96;1671831386.0
/r/DataScience user boldly claims that data science is the most powerful skill in the world. His claim is not met with the same enthusiasm.;215;Kronikle;55;0.96;1671817997.0
Is cleavage NSFW? What does NSFW even mean? Just another day in r/ffxiv!;542;Omega357;164;0.95;1671812568.0
Spicy argument in r/cooking over who *really* invented chicken tikka masala;187;TheLadyEve;37;0.95;1671803639.0
Man continues meltdown about dogs on r/Vermont. Compares dog owners to Westboro Baptist Church members. r/Vermont posts even MORE dog photos.;1207;ReasonableLiving5958;332;0.95;1671802988.0
83-comment argument in r/DeusEx on whether the games Human Revolution and Mankind Divided are prequels to the original Deus Ex game (from 2000) or reboots.;77;bermuda__;48;0.89;1671776935.0
A scammer tricks another redditor into sending him a cactus but he doesn't pay for it, he then makes multiple posts in r/sanpedrocactus in which he calls the VICTIM the scammer. The victim then posts screenshots of their conversation which reveals the truth of the matter, and the scammer gets banned;1895;Thewallinthehole;173;0.99;1671733205.0
The brain flakes CEO does an AMA, one commenter quickly points out the CEOs warped stance on abortion, alex jones, gay people. and immigrants.;1770;ShartedAtCVS;254;0.98;1671713582.0
"One r/196 user insists on using a Greek letter in their spelling because ""it looks better"". Gets questioned, doubles down.";1496;htmlcoderexe;535;0.98;1671705017.0
Gamer Gate drama in Rimworld;184;DoctorAnatomy;160;0.9;1671675102.0
A r/sadcringe user posts about his brother's Raid: Shadow Legends addiction. Users show up to defend their game.;916;IAbstainFromSociety;306;0.98;1671647012.0
A r/CreditCards user asks a question: how do you apply for a credit card without providing any of your personal information? Commenters have a field day explaining just how stupid this question is, and OP isn't happy.;887;IAbstainFromSociety;137;0.98;1671646208.0
OP in r/askmen asks why the subreddit has turned into r/relationships, turns out OP is a hypocrite;956;Nitrozah;207;0.97;1671643482.0
User in r/teachers weirdly tags/calls out another user in comment on their own post. Drama ensues.;431;Ser_Dunk_the_tall;181;0.96;1671603189.0
r/dentistry OP is panicked about his mouth being numb after getting a tooth filled. He takes the opportunity to highjack the thread implying his dentist is fleecing him by doing unnecessary CTs. This devolves into OP threatening the responding dentist with physical violence.;642;Mmedical;88;0.97;1671554846.0
Teenager is eaten alive by r/NewOrleans when he posts his Dahmer halloween costume;1523;majortaster;364;0.97;1671549417.0
"""You guys are worse than the Pharisees."" One brave Redditor enters r/OrthodoxChristianity to let them all know they're worshiping Saturn. Alas, his pleas are ignored by a collective ""lolwut"" from the sub.";1412;DementedMK;349;0.96;1671497055.0
A bugged NPC taking punches in r/DarkTide turns to OP getting punched out and threadlocked as his racist username is exposed;471;GMMoira;171;0.97;1671489197.0
r/CoolGuides users lose their cool when discussing word “haole” used by native Hawaiians;132;Penta-Dunk;112;0.91;1671488836.0
Is water from your dehumidifier waste water with heavy metals that aren't safe for plants? r/hydroponics discusses.;742;hellakevin;211;0.97;1671459631.0
Henry Cavill gets announced as being involved with a Warhammer 40,000 series for Amazon, r/Grimdank reacts;790;ForteEXE;668;0.95;1671433127.0
r/houseplants grapples with AI generated content;1300;VVHYY;453;0.98;1671418900.0
People are not horsing around in r/colts when one user thinks it is better to finish the season strong instead of getting a better draft pick.;177;Ranccor;78;0.96;1671380879.0
Is Binance going to collapse? The Crypto Extended Universe panics about the possibility their coins will become worthless.;1402;StopHavingAnOpinion;484;0.97;1671366712.0
A brand new user goes onto r/CreditCards to ask if having 5 cards at 19 is good. Users accuse him of being underage and a troll.;227;IAbstainFromSociety;40;0.97;1671336219.0
